id;h1;link;meta_keywords;meta_description;original_code;own_code;ean_code;vat_id;base_price;common_retail_price;shopping_price;discount;discount_type;stocked_items;minimal_count;product_availability_id;availability_description;guarantee;guarantee_unit;short_description;main_description;homepage;sale;recommended;show;supplier_id;producer_id;configuration_parameter_group_id;name;is_vat_included;facebook;social_plugin;new_product;discount_since;discount_to;show_top_category_description;show_2nd_top_category_description;show_3rd_top_category_description;max_cpc;toll_free;price_per_descriptive_parameter_id;meta_title;feed_name;categories;relatedProducts
5159;Postelové kování 3704 - 140 mm;postelove-kovani-3704-140-mm;;;;1101035;;5;81,00;0,00;0,00;0,00;1;NULL_VALUE;0,00;7;;2;years;;<p> 	Sada je určena pro jednu postel a obsahuje 8 dílů.</p> ;0;0;0;1;NULL_VALUE;NULL_VALUE;14;Postelové kování 3704 - 140 mm;0;0;NULL_VALUE;0;NULL_VALUE;NULL_VALUE;0;0;0;NULL_VALUE;1;NULL_VALUE;Postelové kování 3704 - 140 mm;Postelové kování 3704 - 140 mm;34;
5160;Postelová středová podpěra 3892;postelova-stredova-podpera-3892;;;;1102030;;5;19,00;0,00;0,00;8,00;0;NULL_VALUE;0,00;7;;2;years;;<p> 	Sada postelové podpěry obsahuje 2 díly. Pro jednu podpěru nutno objednat 2 sady.</p> ;0;0;0;1;NULL_VALUE;NULL_VALUE;14;Postelová středová podpěra 3892;0;0;NULL_VALUE;0;NULL_VALUE;NULL_VALUE;0;0;0;NULL_VALUE;1;NULL_VALUE;Postelová středová podpěra 3892;Postelová středová podpěra 3892;34,39;
5161;Postelová středová podpěra Regulo;postelova-stredova-podpera-regulo;;;;1101110;;5;31,00;0,00;0,00;14,00;0;NULL_VALUE;0,00;7;;2;years;;<p> 	Kování obsahuje 2 díly. &nbsp;Pro jednu podpěru nutno objednat 2 sady.</p> ;0;0;0;1;NULL_VALUE;NULL_VALUE;14;Postelová středová podpěra Regulo;0;0;NULL_VALUE;0;NULL_VALUE;NULL_VALUE;0;0;0;NULL_VALUE;1;NULL_VALUE;Postelová středová podpěra Regulo;Postelová středová podpěra Regulo;34,39;
5162;Houpačková pružina;houpackova-pruzina;;;;6020005;;5;78,00;0,00;0,00;0,00;1;NULL_VALUE;0,00;7;;2;years;;;0;0;0;1;NULL_VALUE;NULL_VALUE;9;Houpačková pružina;0;0;NULL_VALUE;0;NULL_VALUE;NULL_VALUE;0;0;0;NULL_VALUE;1;NULL_VALUE;Houpačková pružina;Houpačková pružina;10;
5163;Spojovací kování pro stolové desky Click catch XL;spojovaci-kovani-pro-stolove-desky-click-catch-xl;;;;2403145;;5;303,00;0,00;0,00;0,00;1;NULL_VALUE;0,00;7;;2;years;;<p> 	Click catch XL je určen pro rozebíratelné spojení více stolů za sebou.</p> ;0;0;0;1;NULL_VALUE;NULL_VALUE;10;Spojovací kování pro stolové desky Click catch XL;0;0;NULL_VALUE;0;NULL_VALUE;NULL_VALUE;0;0;0;NULL_VALUE;1;NULL_VALUE;Spojovací kování pro stolové desky Click catch XL;Spojovací kování pro stolové desky Click catch XL;4;
5164;Rohový příchyt dveřních skel a zrcadel;rohovy-prichyt-dvernich-skel-a-zrcadel;;;;2205070;;5;14,00;0,00;0,00;0,00;1;NULL_VALUE;0,00;10;;2;years;;<p> 	Cena uvedená za kus.&nbsp;</p> ;0;0;0;1;NULL_VALUE;NULL_VALUE;3;Rohový příchyt dveřních skel a zrcadel;0;0;NULL_VALUE;0;NULL_VALUE;NULL_VALUE;0;0;0;NULL_VALUE;1;NULL_VALUE;Rohový příchyt dveřních skel a zrcadel;Rohový příchyt dveřních skel a zrcadel;24;
5165;Závěs na skleněné dveře Grace - polonaložený - nerez;zaves-na-sklenene-dvere-grace-polonalozeny-nerez;;;;1506471;;5;296,00;0,00;0,00;0,00;1;NULL_VALUE;0,00;7;;2;years;;<p> 	Nerezový závěs je určen pro polonaložené skleněné dveře s nutností vrtání do skla. Vyroben z nerez oceli 304.</p> ;0;0;0;1;NULL_VALUE;NULL_VALUE;3;Závěs na skleněné dveře Grace - polonaložený - nerez;0;0;NULL_VALUE;0;NULL_VALUE;NULL_VALUE;0;0;0;NULL_VALUE;1;NULL_VALUE;Závěs na skleněné dveře Grace - polonaložený - nerez;Závěs na skleněné dveře Grace - polonaložený - nerez;21;
5166;Okrasný šroub skleněných tabulí ø25x30 mm;okrasny-sroub-sklenenych-tabuli-25x30-mm;;;;2211140;;5;98,00;0,00;0,00;0,00;1;NULL_VALUE;0,00;7;;2;years;;;0;0;0;1;NULL_VALUE;NULL_VALUE;3;Okrasný šroub skleněných tabulí ø25x30 mm;0;0;NULL_VALUE;0;NULL_VALUE;NULL_VALUE;0;0;0;NULL_VALUE;1;NULL_VALUE;Okrasný šroub skleněných tabulí ø25x30 mm;Okrasný šroub skleněných tabulí ø25x30 mm;24;
5167;Úchytka misková 30342;uchytka-miskova-30342;;;;1723015;;5;59,00;0,00;0,00;0,00;1;NULL_VALUE;0,00;10;;2;years;;;0;0;0;1;NULL_VALUE;NULL_VALUE;16;Úchytka misková 30342;0;0;NULL_VALUE;0;NULL_VALUE;NULL_VALUE;0;0;0;NULL_VALUE;1;NULL_VALUE;Úchytka misková 30342;Úchytka misková 30342;12;
5168;Úchytka 36103;uchytka-36103;;;;1724280;;5;57,00;0,00;0,00;0,00;1;NULL_VALUE;0,00;7;;2;years;;;0;0;0;1;NULL_VALUE;NULL_VALUE;16;Úchytka 36103;0;0;NULL_VALUE;0;NULL_VALUE;NULL_VALUE;0;0;0;NULL_VALUE;1;NULL_VALUE;Úchytka 36103;Úchytka 36103;12;
5169;Úchytka 30175;uchytka-30175;;;;1723030;;5;20,00;0,00;0,00;0,00;1;NULL_VALUE;0,00;10;;2;years;;;0;0;0;1;NULL_VALUE;NULL_VALUE;16;Úchytka 30175;0;0;NULL_VALUE;0;NULL_VALUE;NULL_VALUE;0;0;0;NULL_VALUE;1;NULL_VALUE;Úchytka 30175;Úchytka 30175;12;
5170;Úchytka Antika 30368;uchytka-antika-30368;;;;1723011;;5;35,00;0,00;0,00;0,00;1;NULL_VALUE;0,00;10;;2;years;;;0;0;0;1;NULL_VALUE;NULL_VALUE;16;Úchytka Antika 30368;0;0;NULL_VALUE;0;NULL_VALUE;NULL_VALUE;0;0;0;NULL_VALUE;1;NULL_VALUE;Úchytka Antika 30368;Úchytka Antika 30368;12;
5171;Úchytka 23367;uchytka-23367;;;;1723045;;5;21,00;0,00;0,00;0,00;1;NULL_VALUE;0,00;10;;2;years;;;0;0;0;1;NULL_VALUE;NULL_VALUE;16;Úchytka 23367;0;0;NULL_VALUE;0;NULL_VALUE;NULL_VALUE;0;0;0;NULL_VALUE;1;NULL_VALUE;Úchytka 23367;Úchytka 23367;12;
5172;Úchytka zadlabací 6320;uchytka-zadlabaci-6320;;;;1786755;;5;124,00;0,00;0,00;0,00;1;NULL_VALUE;0,00;7;;2;years;;;0;0;0;1;NULL_VALUE;NULL_VALUE;16;Úchytka zadlabací 6320;0;0;NULL_VALUE;0;NULL_VALUE;NULL_VALUE;0;0;0;NULL_VALUE;1;NULL_VALUE;Úchytka zadlabací 6320;Úchytka zadlabací 6320;12;
5173;Podpěra skleněných polic;podpera-sklenenych-polic;;;;2202231;;5;7,00;0,00;0,00;0,00;1;NULL_VALUE;0,00;7;;2;years;;;0;0;0;1;NULL_VALUE;NULL_VALUE;3;Podpěra skleněných polic;0;0;NULL_VALUE;0;NULL_VALUE;NULL_VALUE;0;0;0;NULL_VALUE;1;NULL_VALUE;Podpěra skleněných polic;Podpěra skleněných polic;20;
5174;Podpěra skleněných polic Alfa;podpera-sklenenych-polic-alfa;;;;2202245;;5;32,00;0,00;0,00;0,00;1;NULL_VALUE;0,00;7;;2;years;;;0;0;0;1;NULL_VALUE;NULL_VALUE;3;Podpěra skleněných polic Alfa;0;0;NULL_VALUE;0;NULL_VALUE;NULL_VALUE;0;0;0;NULL_VALUE;1;NULL_VALUE;Podpěra skleněných polic Alfa;Podpěra skleněných polic Alfa;20;
5175;Dvouválečkový úchyt;dvouvaleckovy-uchyt;;;;2201500;;5;14,00;0,00;0,00;0,00;1;NULL_VALUE;0,00;7;;2;years;;<p> 	Úchyt je dodáván vč. protiplechu.</p> ;0;0;0;1;NULL_VALUE;NULL_VALUE;13;Dvouválečkový úchyt;0;0;NULL_VALUE;0;NULL_VALUE;NULL_VALUE;0;0;0;NULL_VALUE;1;NULL_VALUE;Dvouválečkový úchyt;Dvouválečkový úchyt;33;
5176;Magnet nábytkový;magnet-nabytkovy;;;;53467a55d1930;;5;0,00;0,00;0,00;0,00;1;NULL_VALUE;0,00;7;;2;years;;<p> 	Magnet je dodáván vč. protiplechu.</p> ;0;0;0;1;NULL_VALUE;NULL_VALUE;13;Magnet nábytkový;0;0;NULL_VALUE;0;NULL_VALUE;NULL_VALUE;0;0;0;NULL_VALUE;1;NULL_VALUE;Magnet nábytkový;Magnet nábytkový;33;
5178;Mini latch - zátlačný příchyt;mini-latch-zatlacny-prichyt;;;;534cd1851f5ad;;5;0,00;0,00;0,00;0,00;1;NULL_VALUE;0,00;7;;2;years;;<p> 	<span stylecolor: rgb(51, 51, 51); font-family: Arial, sans-serif; font-size: 10pt; line-height: 115%;>Zátlačný příchyt slouží k&nbsp;otevírání dvířek bez úchytky. Při mírném zatlačení do dvířek se dvířka sami pootevřou.&</span></p> ;0;0;0;1;NULL_VALUE;NULL_VALUE;13;Mini latch - zátlačný příchyt;0;0;NULL_VALUE;0;NULL_VALUE;NULL_VALUE;0;0;0;NULL_VALUE;1;NULL_VALUE;Mini latch - zátlačný příchyt;Mini latch - zátlačný příchyt;33;
5179;Magnet pružinový válcový;magnet-pruzinovy-valcovy;;;;2201095;;5;5,00;0,00;0,00;0,00;1;NULL_VALUE;0,00;7;;2;years;;;0;0;0;1;NULL_VALUE;NULL_VALUE;13;Magnet pružinový válcový;0;0;NULL_VALUE;0;NULL_VALUE;NULL_VALUE;0;0;0;NULL_VALUE;1;NULL_VALUE;Magnet pružinový válcový;Magnet pružinový válcový;33;
5180;Magnet pružinový kruhový;magnet-pruzinovy-kruhovy;;;;2201070;;5;14,00;0,00;0,00;0,00;1;NULL_VALUE;0,00;7;;2;years;;;0;0;0;1;NULL_VALUE;NULL_VALUE;13;Magnet pružinový kruhový;0;0;NULL_VALUE;0;NULL_VALUE;NULL_VALUE;0;0;0;NULL_VALUE;1;NULL_VALUE;Magnet pružinový kruhový;Magnet pružinový kruhový;33;
5181;Magnet pružinový čtvercový;magnet-pruzinovy-ctvercovy;;;;2201075;;5;14,00;0,00;0,00;0,00;1;NULL_VALUE;0,00;7;;2;years;;;0;0;0;1;NULL_VALUE;NULL_VALUE;13;Magnet pružinový čtvercový;0;0;NULL_VALUE;0;NULL_VALUE;NULL_VALUE;0;0;0;NULL_VALUE;1;NULL_VALUE;Magnet pružinový čtvercový;Magnet pružinový čtvercový;33;
5182;Protiplech kruhový lepící;protiplech-kruhovy-lepici;;;;2201118;;5;4,00;0,00;0,00;0,00;1;NULL_VALUE;0,00;7;;2;years;;;0;0;0;1;NULL_VALUE;NULL_VALUE;13;Protiplech kruhový lepící;0;0;NULL_VALUE;0;NULL_VALUE;NULL_VALUE;0;0;0;NULL_VALUE;1;NULL_VALUE;Protiplech kruhový lepící;Protiplech kruhový lepící;33;
5183;Protiplech čtvercový lepící;protiplech-ctvercovy-lepici;;;;2201127;;5;4,00;0,00;0,00;0,00;1;NULL_VALUE;0,00;7;;2;years;;;0;0;0;1;NULL_VALUE;NULL_VALUE;13;Protiplech čtvercový lepící;0;0;NULL_VALUE;0;NULL_VALUE;NULL_VALUE;0;0;0;NULL_VALUE;1;NULL_VALUE;Protiplech čtvercový lepící;Protiplech čtvercový lepící;33;
5184;Magnet narážecí X-S2;magnet-narazeci-x-s2;;;;2201063;;5;15,00;0,00;0,00;0,00;1;NULL_VALUE;0,00;7;;2;years;;<p> 	Magnet je dodáván vč. protiplechu.</p> ;0;0;0;1;NULL_VALUE;NULL_VALUE;13;Magnet narážecí X-S2;0;0;NULL_VALUE;0;NULL_VALUE;NULL_VALUE;0;0;0;NULL_VALUE;1;NULL_VALUE;Magnet narážecí X-S2;Magnet narážecí X-S2;33;
5185;Magnet narážecí válcový X-S1;magnet-narazeci-valcovy-x-s1;;;;2201057;;5;19,00;0,00;0,00;0,00;1;NULL_VALUE;0,00;7;;2;years;;<p> 	Magnet je dodáván vč. protiplechu.</p> ;0;0;0;1;NULL_VALUE;NULL_VALUE;13;Magnet narážecí válcový X-S1;0;0;NULL_VALUE;0;NULL_VALUE;NULL_VALUE;0;0;0;NULL_VALUE;1;NULL_VALUE;Magnet narážecí válcový X-S1;Magnet narážecí válcový X-S1;33;
5186;Protiplech kruhový ø14 mm;protiplech-kruhovy-14-mm;;;;2201115;;5;3,00;0,00;0,00;0,00;1;NULL_VALUE;0,00;7;;2;years;;;0;0;0;1;NULL_VALUE;NULL_VALUE;13;Protiplech kruhový ø14 mm;0;0;NULL_VALUE;0;NULL_VALUE;NULL_VALUE;0;0;0;NULL_VALUE;1;NULL_VALUE;Protiplech kruhový ø14 mm;Protiplech kruhový ø14 mm;33;
5187;Protiplech kruhový ø14 mm s hřebíkem ;protiplech-kruhovy-14-mm-s-hrebikem;;;;2201110;;5;7,00;0,00;0,00;0,00;1;NULL_VALUE;0,00;7;;2;years;;;0;0;0;1;NULL_VALUE;NULL_VALUE;13;Protiplech kruhový ø14 mm s hřebíkem ;0;0;NULL_VALUE;0;NULL_VALUE;NULL_VALUE;0;0;0;NULL_VALUE;1;NULL_VALUE;Protiplech kruhový ø14 mm s hřebíkem ;Protiplech kruhový ø14 mm s hřebíkem ;33;
5188;Protiplech čtvercový;protiplech-ctvercovy;;;;2201125;;5;4,00;0,00;0,00;0,00;1;NULL_VALUE;0,00;7;;2;years;;;0;0;0;1;NULL_VALUE;NULL_VALUE;13;Protiplech čtvercový;0;0;NULL_VALUE;0;NULL_VALUE;NULL_VALUE;0;0;0;NULL_VALUE;1;NULL_VALUE;Protiplech čtvercový;Protiplech čtvercový;33;
5189;Přísavná podložka pro skleněné díly stolu ø15 mm;prisavna-podlozka-pro-sklenene-dily-stolu-15-mm;;;;1038210;;5;4,00;0,00;0,00;0,00;1;NULL_VALUE;0,00;7;;2;years;;;0;0;0;1;NULL_VALUE;NULL_VALUE;10;Přísavná podložka pro skleněné díly stolu ø15 mm;0;0;NULL_VALUE;0;NULL_VALUE;NULL_VALUE;0;0;0;NULL_VALUE;1;NULL_VALUE;Přísavná podložka pro skleněné díly stolu ø15 mm;Přísavná podložka pro skleněné díly stolu ø15 mm;4;
5191;Přísavná podložka pro skleněné díly stolu ø20 mm;prisavna-podlozka-pro-sklenene-dily-stolu-20-mm;;;;1038220;;5;4,00;0,00;0,00;0,00;1;NULL_VALUE;0,00;7;;2;years;;;0;0;0;1;NULL_VALUE;NULL_VALUE;10;Přísavná podložka pro skleněné díly stolu ø20 mm;0;0;NULL_VALUE;0;NULL_VALUE;NULL_VALUE;0;0;0;NULL_VALUE;1;NULL_VALUE;Přísavná podložka pro skleněné díly stolu ø20 mm;Přísavná podložka pro skleněné díly stolu ø20 mm;4;
5192;Úchytka Vesuvio I;uchytka-vesuvio-i;;;;1704680;;5;50,00;0,00;0,00;0,00;1;NULL_VALUE;0,00;7;;2;years;;;0;0;0;1;NULL_VALUE;NULL_VALUE;16;Úchytka Vesuvio I;0;0;NULL_VALUE;0;NULL_VALUE;NULL_VALUE;0;0;0;NULL_VALUE;1;NULL_VALUE;Úchytka Vesuvio I;Úchytka Vesuvio I;12;
5193;Úchytka Vesuvio II;uchytka-vesuvio-ii;;;;1704675;;5;77,00;0,00;0,00;0,00;1;NULL_VALUE;0,00;7;;2;years;;;0;0;0;1;NULL_VALUE;NULL_VALUE;16;Úchytka Vesuvio II;0;0;NULL_VALUE;0;NULL_VALUE;NULL_VALUE;0;0;0;NULL_VALUE;1;NULL_VALUE;Úchytka Vesuvio II;Úchytka Vesuvio II;12;
5194;Zástrč nábytková č.352/50 mm ;zastrc-nabytkova-352-50-mm;;;;2206004;;5;19,00;0,00;0,00;0,00;1;NULL_VALUE;0,00;7;;2;years;;<p> 	Zástrč je dodávána vč. protiplechu.</p> ;0;0;0;1;NULL_VALUE;NULL_VALUE;13;Zástrč nábytková č.352/50 mm ;0;0;NULL_VALUE;0;NULL_VALUE;NULL_VALUE;0;0;0;NULL_VALUE;1;NULL_VALUE;Zástrč nábytková č.352/50 mm ;Zástrč nábytková č.352/50 mm ;33;
5195;Zástrč nábytková č.353/50 mm;zastrc-nabytkova-c353-50mm;;;;2206010;;5;14,00;0,00;0,00;0,00;1;NULL_VALUE;0,00;7;;2;years;;<p> 	Zástrč je dodávána vč. protiplechu.</p> ;0;0;0;1;NULL_VALUE;NULL_VALUE;13;Zástrč nábytková č.353/50 mm;0;0;NULL_VALUE;0;NULL_VALUE;NULL_VALUE;0;0;0;NULL_VALUE;1;NULL_VALUE;Zástrč nábytková č.353/50 mm;Zástrč nábytková č.353/50 mm;33;
5196;Zástrč nábytková č.7403/70 mm;zastrc-nabytkova-c7403-70mm;;;;2206040;;5;19,00;0,00;0,00;0,00;1;NULL_VALUE;0,00;7;;2;years;;<p> 	Zástrč je dodávána vč. protiplechu.</p> ;0;0;0;1;NULL_VALUE;NULL_VALUE;13;Zástrč nábytková č.7403/70 mm;0;0;NULL_VALUE;0;NULL_VALUE;NULL_VALUE;0;0;0;NULL_VALUE;1;NULL_VALUE;Zástrč nábytková č.7403/70 mm;Zástrč nábytková č.7403/70 mm;33;
5197;Zástrč  nábytková č.7404/70 mm;zastrc-nabytkova-c7404-70mm;;;;534e688457f10;;5;0,00;0,00;0,00;0,00;1;NULL_VALUE;0,00;7;;2;years;;<p> 	Zástrč je dodávána vč. protiplechu.</p> ;0;0;0;1;NULL_VALUE;NULL_VALUE;13;Zástrč  nábytková č.7404/70 mm;0;0;NULL_VALUE;0;NULL_VALUE;NULL_VALUE;0;0;0;NULL_VALUE;1;NULL_VALUE;Zástrč  nábytková č.7404/70 mm;Zástrč  nábytková č.7404/70 mm;33;
5198;Police na ručníky;police-na-rucniky;;;;1773010;;5;1191,00;0,00;0,00;424,00;0;NULL_VALUE;0,00;7;;2;years;;<p> 	Vyrobeno z nerez oceli 304.</p> ;0;0;0;1;NULL_VALUE;NULL_VALUE;15;Police na ručníky;0;0;NULL_VALUE;0;NULL_VALUE;NULL_VALUE;0;0;0;NULL_VALUE;1;NULL_VALUE;Police na ručníky;Police na ručníky;35,39;
5199;Držák na ručník dvojitý;drzak-na-rucnik-dvojity;;;;1773020;;5;512,00;0,00;0,00;182,00;0;NULL_VALUE;0,00;7;;2;years;;<p> 	Vyroben z nerez oceli 304.</p> ;0;0;0;1;NULL_VALUE;NULL_VALUE;15;Držák na ručník dvojitý;0;0;NULL_VALUE;0;NULL_VALUE;NULL_VALUE;0;0;0;NULL_VALUE;1;NULL_VALUE;Držák na ručník dvojitý;Držák na ručník dvojitý;35,39;
5200;Držák na ručník jednoduchý;drzak-na-rucnik-jednoduchy;;;;1773015;;5;381,00;0,00;0,00;136,00;0;NULL_VALUE;0,00;7;;2;years;;<p> 	Vyroben z nerez oceli 304.</p> ;0;0;0;1;NULL_VALUE;NULL_VALUE;15;Držák na ručník jednoduchý;0;0;NULL_VALUE;0;NULL_VALUE;NULL_VALUE;0;0;0;NULL_VALUE;1;NULL_VALUE;Držák na ručník jednoduchý;Držák na ručník jednoduchý;35,39;
5201;Věšák na ručník I;vesak-na-rucnik-i;;;;1773100;;5;335,00;0,00;0,00;119,00;0;NULL_VALUE;0,00;7;;2;years;;<p> 	Věšák je dodáván v párech. Vyroben z nerez oceli 304.</p> ;0;0;0;1;NULL_VALUE;NULL_VALUE;15;Věšák na ručník I;0;0;NULL_VALUE;0;NULL_VALUE;NULL_VALUE;0;0;0;NULL_VALUE;1;NULL_VALUE;Věšák na ručník I;Věšák na ručník I;35,39;
5202;Věšák na ručník II;vesak-na-rucnik-ii;;;;1773105;;5;314,00;0,00;0,00;112,00;0;NULL_VALUE;0,00;7;;2;years;;<p> 	Věšák je dodáván v párech. Vyroben z nerez oceli 304.</p> ;0;0;0;1;NULL_VALUE;NULL_VALUE;15;Věšák na ručník II;0;0;NULL_VALUE;0;NULL_VALUE;NULL_VALUE;0;0;0;NULL_VALUE;1;NULL_VALUE;Věšák na ručník II;Věšák na ručník II;35,39;
5203;Držák toaletního papíru;drzak-toaletniho-papiru;;;;1773000;;5;385,00;0,00;0,00;137,00;0;NULL_VALUE;0,00;7;;2;years;;<p> 	Vyroben z nerez oceli 304.</p> ;0;0;0;1;NULL_VALUE;NULL_VALUE;15;Držák toaletního papíru;0;0;NULL_VALUE;0;NULL_VALUE;NULL_VALUE;0;0;0;NULL_VALUE;1;NULL_VALUE;Držák toaletního papíru;Držák toaletního papíru;35,39;
5204;Držák toaletní štětky;drzak-toaletni-stetky;;;;1773030;;5;620,00;0,00;0,00;221,00;0;NULL_VALUE;0,00;10;;2;years;;<p> 	Držák je dodáván vč. štětky. Vyroben z nerez oceli 304.</p> ;0;0;0;1;NULL_VALUE;NULL_VALUE;15;Držák toaletní štětky;0;0;NULL_VALUE;0;NULL_VALUE;NULL_VALUE;0;0;0;NULL_VALUE;1;NULL_VALUE;Držák toaletní štětky;Držák toaletní štětky;35;
5205;Nábytkový zámek T-klika typ 1800 pro plechový nábytek;nabytkovy-zamek-t-klika-typ-1800-pro-plechovy-nabytek;;;;59352526d6af6;;5;145,00;0,00;0,00;0,00;1;NULL_VALUE;0,00;7;;2;years;;<p> 	Montáž zámku s čelní strany.&nbsp;<span stylefont-family: proxima-nova, sans-serif; font-size: 13px;>Zámek slouží k zamykání plechových skříní, boxů, autoskříní a garážových vrat.</span></p> ;0;0;0;1;NULL_VALUE;NULL_VALUE;1;Nábytkový zámek T-klika typ 1800 pro plechový nábytek;0;0;NULL_VALUE;0;NULL_VALUE;NULL_VALUE;0;0;0;NULL_VALUE;1;NULL_VALUE;Nábytkový zámek T-klika typ 1800 pro plechový nábytek;Nábytkový zámek T-klika typ 1800 pro plechový nábytek;16;
5206;Nábytkový zámek typ M-175 pro plechový nábytek;nabytkovy-zamek-typ-m-175-pro-plechovy-nabytek;;;;1408019;;5;151,00;0,00;0,00;0,00;1;NULL_VALUE;0,00;7;;2;years;;<p> 	Zámek slouží k zamykání plechových skříní a boxů.</p> ;0;0;0;1;NULL_VALUE;NULL_VALUE;1;Nábytkový zámek typ M-175 pro plechový nábytek;0;0;NULL_VALUE;0;NULL_VALUE;NULL_VALUE;0;0;0;NULL_VALUE;1;NULL_VALUE;Nábytkový zámek typ M-175 pro plechový nábytek;Nábytkový zámek typ M-175 pro plechový nábytek;16;
5207;Tlumící kroužek ø6 mm;tlumici-krouzek-6-mm;;;;2202114;;5;3,00;0,00;0,00;0,00;1;NULL_VALUE;0,00;7;;2;years;;<p> 	Tlumící kroužek slouží např. k podpěrám skleněných polic &nbsp;jednoduchých a dvojitých (2202115, 2202116).&nbsp;</p> ;0;0;0;1;NULL_VALUE;NULL_VALUE;3;Tlumící kroužek ø6 mm;0;0;NULL_VALUE;0;NULL_VALUE;NULL_VALUE;0;0;0;NULL_VALUE;1;NULL_VALUE;Tlumící kroužek ø6 mm;Tlumící kroužek ø6 mm;27;
5208;Tlumící kroužek ø4,3 mm;tlumici-krouzek-43-mm;;;;1213456;;5;1,00;0,00;0,00;0,00;1;NULL_VALUE;0,00;7;;2;years;;<p> 	Tlumící kroužek slouží např. k podložení úchytky a šroubu M4 na skleněné dveře.</p> ;0;1;0;1;NULL_VALUE;NULL_VALUE;3;Tlumící kroužek ø4,3 mm;0;0;NULL_VALUE;0;NULL_VALUE;NULL_VALUE;0;0;0;NULL_VALUE;1;NULL_VALUE;Tlumící kroužek ø4,3 mm;Tlumící kroužek ø4,3 mm;27;
5209;Těsnící lišta pro sprchové kouty S-5714;tesnici-lista-pro-sprchove-kouty-s-5714;;;;53578e6115e78;;5;0,00;0,00;0,00;0,00;1;NULL_VALUE;0,00;7;;2;years;;<p> 	Těsnění je vyrobeno z průhledného PVC pro tloušťky skel 6-12mm a je dodáváno v délce 2,5m. Cena uvedena za celý kus.</p> <p> 	<strong>Pozn.: Při rozměru do 2m se účtuje dopravné 150,-Kč bez DPH (převodem)/ 195,-Kč bez DPH (dob�&�rkou) a při rozměru nad 2m se účtuje dopravné 305,-Kč bez DPH (převodem)/ 350,-Kč bez DPH (dobírkou). V případě fyzické úpravy zboží (zkrácení apod.) dle přání zákazníka, za účelem snížení dopravného, ztrácí &nbsp;zákazn�&�k nárok na vrácení zboží dodavateli s následným vrácením peněz, jak je uvedeno ve všeobecných obchodních podmínkách pro e-shopy.</strong></p> ;0;0;0;1;NULL_VALUE;NULL_VALUE;3;Těsnící lišta pro sprchové kouty S-5714;0;0;NULL_VALUE;0;NULL_VALUE;NULL_VALUE;0;0;0;NULL_VALUE;1;NULL_VALUE;Těsnící lišta pro sprchové kouty S-5714;Těsnící lišta pro sprchové kouty S-5714;32;
5210;Těsnící lišta pro sprchové kouty S-5715;tesnici-lista-pro-sprchove-kouty-s-5715;;;;53579b6a5e602;;5;0,00;0,00;0,00;0,00;1;NULL_VALUE;0,00;7;;2;years;;<p> 	Těsnění je vyrobeno z průhledného PVC pro tloušťky skel 6-12mm a je dodáváno v délce 2,5m. Cena uvedena za celý kus.</p> <p> 	<strong>Pozn.: Při rozměru do 2m se účtuje dopravné 150,-Kč bez DPH (převodem)/ 195,-Kč bez DPH (dob�&�rkou) a při rozměru nad 2m se účtuje dopravné 305,-Kč bez DPH (převodem)/ 350,-Kč bez DPH (dobírkou). V případě fyzické úpravy zboží (zkrácení apod.) dle přání zákazníka, za účelem snížení dopravného, ztrácí &nbsp;zákazn�&�k nárok na vrácení zboží dodavateli s následným vrácením peněz, jak je uvedeno ve všeobecných obchodních podmínkách pro e-shopy.</strong></p> ;0;0;0;1;NULL_VALUE;NULL_VALUE;3;Těsnící lišta pro sprchové kouty S-5715;0;0;NULL_VALUE;0;NULL_VALUE;NULL_VALUE;0;0;0;NULL_VALUE;1;NULL_VALUE;Těsnící lišta pro sprchové kouty S-5715;Těsnící lišta pro sprchové kouty S-5715;32;
5211;Centrální zásuvkový zámek 851N/800/3-boční;centralni-zasuvkovy-zamek-851n8003-bocni;;;;1401329;;5;180,00;0,00;0,00;0,00;1;NULL_VALUE;0,00;7;;2;years;;<p> 	Zámek určený k centrálnímu zamykání zásuvek nad sebou, pomocí jednoho zámku a táhla.</p> <p> 	Využití:</p> <p> 	Zámek určený k centrálnímu zamykání 3ks zásuvek nad sebou s boční montáží zámku. Pro více zásuvek je nu&tno dokoupit blokovací kolíky navíc. Při nevhodné výšce blokovacího kolíku 13mm, možnost dokoupení kolíků o výšce 8mm nebo 19mm.&nbsp;<span stylefont-family: proxima-nova, sans-serif; font-size: 13px; line-height: 18.2px; text-align: ju&stify;>V případě použití tzv. blokací zásuvek, doporučujeme objednat plastové blokovací segmenty pro každou zásuvku.</span></p> ;0;0;0;1;NULL_VALUE;NULL_VALUE;1;Centrální zásuvkový zámek 851N/800/3-boční;0;0;NULL_VALUE;0;NULL_VALUE;NULL_VALUE;0;0;0;NULL_VALUE;1;NULL_VALUE;Centrální zásuvkový zámek 851N/800/3-boční;Centrální zásuvkový zámek 851N/800/3-boční;15;
5212;Výsuv pro klávesnici typ 444;vysuv-pro-klavesnici-typ-444;klávesnice;;;2523181;;5;272,00;0,00;0,00;0,00;1;NULL_VALUE;0,00;7;;2;years;;;0;0;0;1;NULL_VALUE;NULL_VALUE;11;Výsuv pro klávesnici typ 444;0;0;NULL_VALUE;0;NULL_VALUE;NULL_VALUE;0;0;0;NULL_VALUE;1;NULL_VALUE;Výsuv pro klávesnici typ 444;Výsuv pro klávesnici typ 444;7;
5213;Závěs na sklo Badge;zaves-na-sklo-badge;;;;1506201;;5;284,00;0,00;0,00;0,00;1;NULL_VALUE;0,00;7;;2;years;;<p styletext-align: justify;> 	Závěs na sklo je dodáván v párech tzn. horní a dolní díl a slouží pro vložené skleněné dveře bez nutnosti vrtání do skla. V případě požadavku vrtání do skla jsou součástí balení přídavné &šrouby s čepem ø5mm, které rovněž slouží k uchycení závěsu za pomocí otvoru ve skle.&nbsp;</p> ;0;0;0;1;NULL_VALUE;NULL_VALUE;3;Závěs na sklo Badge;0;0;NULL_VALUE;0;NULL_VALUE;NULL_VALUE;0;0;0;NULL_VALUE;1;NULL_VALUE;Závěs na sklo Badge;Závěs na sklo Badge;25;
5214;Závěs na sklo Badge středový levý;zaves-na-sklo-badge-stredovy-levy;;;;1506246;;5;136,00;0,00;0,00;0,00;1;NULL_VALUE;0,00;7;;2;years;;<p styletext-align: justify;> 	<span styletext-align: justify;>Závěs na sklo slouží jako přídavný závěs pro větší rozměry skleněných dveří. Použití je pro vložené skleněné dveře bez nutnosti vrtání do skla. V případ&ě požadavku vrtání do skla jsou součástí balení přídavné šrouby s čepem ø5mm, které rovněž slouží k uchycení závěsu za pomocí otvoru ve skle.</span></p> ;0;0;0;1;NULL_VALUE;NULL_VALUE;3;Závěs na sklo Badge středový levý;0;0;NULL_VALUE;0;NULL_VALUE;NULL_VALUE;0;0;0;NULL_VALUE;1;NULL_VALUE;Závěs na sklo Badge středový levý;Závěs na sklo Badge středový levý;25;
5215;Úchytka na sklo Badge;uchytka-na-sklo-badge;;;;1740051;;5;92,00;0,00;0,00;0,00;1;NULL_VALUE;0,00;7;;2;years;;<p styletext-align: justify;> 	<span styletext-align: justify;>Úchytka slouží k uchycení jednoho křídla skleněných dveří. Použití je pro vložené skleněné dveře bez nutnosti vrtání do skla. V případě požadavku vrtání do& skla jsou součástí balení přídavné šrouby s čepem ø5mm, které rovněž slouží k uchycení závěsu za pomocí otvoru ve skle.</span></p> ;0;0;0;1;NULL_VALUE;NULL_VALUE;3;Úchytka na sklo Badge;0;0;NULL_VALUE;0;NULL_VALUE;NULL_VALUE;0;0;0;NULL_VALUE;1;NULL_VALUE;Úchytka na sklo Badge;Úchytka na sklo Badge;25;
5216;Úchytka na dvoukřídlé skleněné dveře Badge;uchytka-na-dvoukridle-sklenene-dvere-badge;;;;1740071;;5;113,00;0,00;0,00;0,00;1;NULL_VALUE;0,00;7;;2;years;;<p styletext-align: justify;> 	<span styletext-align: justify;>Úchytky jsou dodávány v párech (pravá+levá) a slouží k uchycení dvou křídel skleněných dveří. Použití je pro vložené skleněné dveře bez nutnosti vrtání do s&kla. V případě požadavku vrtání do skla jsou součástí balení přídavné šrouby s čepem ø5mm, které rovněž slouží k uchycení závěsu za pomocí otvoru ve skle.&nbsp;</span></p> ;0;0;0;1;NULL_VALUE;NULL_VALUE;3;Úchytka na dvoukřídlé skleněné dveře Badge;0;0;NULL_VALUE;0;NULL_VALUE;NULL_VALUE;0;0;0;NULL_VALUE;1;NULL_VALUE;Úchytka na dvoukřídlé skleněné dveře Badge;Úchytka na dvoukřídlé skleněné dveře Badge;25;
5217;Zámek na sklo Badge;zamek-na-sklo-badge;;;;1409501;;5;174,00;0,00;0,00;0,00;1;NULL_VALUE;0,00;7;;2;years;;<p> 	Zámek slouží k uzamykání jednoho křídla skleněných dveří do půdy nebo dna korpusu bez nutnosti vrtání otvoru do skla.</p> ;0;0;0;1;NULL_VALUE;NULL_VALUE;1;Zámek na sklo Badge;0;0;NULL_VALUE;0;NULL_VALUE;NULL_VALUE;0;0;0;NULL_VALUE;1;NULL_VALUE;Zámek na sklo Badge;Zámek na sklo Badge;25;
