id;h1;link;meta_keywords;meta_description;original_code;own_code;ean_code;vat_id;base_price;common_retail_price;shopping_price;discount;discount_type;stocked_items;minimal_count;product_availability_id;availability_description;guarantee;guarantee_unit;short_description;main_description;homepage;sale;recommended;show;supplier_id;producer_id;configuration_parameter_group_id;name;is_vat_included;facebook;social_plugin;new_product;discount_since;discount_to;show_top_category_description;show_2nd_top_category_description;show_3rd_top_category_description;max_cpc;toll_free;price_per_descriptive_parameter_id;meta_title;feed_name;categories;relatedProducts
5349;Závěs Slim celomosaz;zaves-slim-celomosaz;;;;1511215;;5;62,00;0,00;0,00;0,00;1;NULL_VALUE;0,00;7;;2;years;;;0;0;0;1;NULL_VALUE;NULL_VALUE;7;Závěs Slim celomosaz;0;0;NULL_VALUE;0;NULL_VALUE;NULL_VALUE;0;0;0;NULL_VALUE;1;NULL_VALUE;Závěs Slim celomosaz;Závěs Slim celomosaz;4,8,10;
5350;Závěs do masivu Straight;zaves-do-masivu-straight;;;;1520200;;5;21,00;0,00;0,00;0,00;1;NULL_VALUE;0,00;7;;2;years;;<p> 	Závěs do masivu je určen pro vložené dveře.</p> ;0;0;0;1;NULL_VALUE;NULL_VALUE;7;Závěs do masivu Straight;0;0;NULL_VALUE;0;NULL_VALUE;NULL_VALUE;0;0;0;NULL_VALUE;1;NULL_VALUE;Závěs do masivu Straight;Závěs do masivu Straight;8;
5351;Pojistný kolík;pojistny-kolik;;;;0405085;;5;61,00;0,00;0,00;0,00;1;NULL_VALUE;0,00;7;;2;years;;<p> 	Kolík slouží k zajištění &nbsp;židle proti složení. &nbsp;</p> ;0;0;0;1;NULL_VALUE;NULL_VALUE;9;Pojistný kolík;0;0;NULL_VALUE;0;NULL_VALUE;NULL_VALUE;0;0;0;NULL_VALUE;1;NULL_VALUE;Pojistný kolík;Pojistný kolík;10;
5352;Dorazový plech levý s otvorem pro pojistný kolík ;dorazovy-plech-levy-s-otvorem-pro-pojistny-kolik;;;;0404955;;5;0,00;0,00;0,00;0,00;1;NULL_VALUE;0,00;10;;2;years;;;0;0;0;1;NULL_VALUE;NULL_VALUE;9;Dorazový plech levý s otvorem pro pojistný kolík ;0;0;NULL_VALUE;0;NULL_VALUE;NULL_VALUE;0;0;0;NULL_VALUE;1;NULL_VALUE;Dorazový plech levý s otvorem pro pojistný kolík ;Dorazový plech levý s otvorem pro pojistný kolík ;10;
5353;Systém MAXI LUNA - segment s maticí M8;system-maxi-luna-segment-s-matici-m8;;;;1104242;;5;15,00;0,00;0,00;0,00;1;NULL_VALUE;0,00;7;;2;years;;<p> 	Segment s maticí je nedílnou součástí systému Maxi luna a každý díl se musí objednat zvlášť.</p> ;0;0;0;1;NULL_VALUE;NULL_VALUE;6;Systém MAXI LUNA - segment s maticí M8;0;0;NULL_VALUE;0;NULL_VALUE;NULL_VALUE;0;0;0;NULL_VALUE;1;NULL_VALUE;Systém MAXI LUNA - segment s maticí M8;Systém MAXI LUNA - segment s maticí M8;6;
5354;Spojovací kování Zimak;spojovaci-kovani-zimak;;;;1101500;;5;44,00;0,00;0,00;0,00;1;NULL_VALUE;0,00;7;;2;years;;<p> 	Spojovací kování Zimak slouží jako neviditelný spoj při velkém zatížení např. u postelí, stolů atd. Je dodáváno v kompletu samec + samice.</p> ;0;0;0;1;NULL_VALUE;NULL_VALUE;6;Spojovací kování Zimak;0;0;NULL_VALUE;0;NULL_VALUE;NULL_VALUE;0;0;0;NULL_VALUE;1;NULL_VALUE;Spojovací kování Zimak;Spojovací kování Zimak;4,6,34;
5355;Stolová bezdrátová nabíječka pro Smartphony;stolova-bezdratova-nabijecka-pro-smartphony;;;;2522703;;5;1150,00;0,00;0,00;0,00;1;NULL_VALUE;0,00;8;;2;years;;<p> 	Tato nabíječka využívá QI technologii. SISO nabíječka umožňuje bezdrátové nabíjení všech QI kompatibilních chytrých telefonů. Je určena pro nabíjení velkého množství značek jako např. Samsung, Apple, Nokia, Sony, LG, Motoro&la a HTC, které splňují QI standard.</p> <p> 	<strong>Je ideální pro zaplnění otvoru o ø80 mm po průchodkách na pracovních stolech, v horních deskách skříněk atd</strong><strong>.</strong></p> <p> 	<strong>Přijímač je nutno objedna&t zvlášť dle typu telefonu.&nbsp;</strong></p> ;0;0;0;1;NULL_VALUE;NULL_VALUE;13;Stolová bezdrátová nabíječka pro Smartphony;0;0;NULL_VALUE;0;NULL_VALUE;NULL_VALUE;0;0;0;NULL_VALUE;1;NULL_VALUE;Stolová bezdrátová nabíječka pro Smartphony;Stolová bezdrátová nabíječka pro Smartphony;33;
5356;Přijímač (receiver) pro bezdrátové nabíjení;prijimac-receiver-pro-bezdratove-nabijeni;;;;556c42981498b;;5;0,00;0,00;0,00;0,00;1;NULL_VALUE;0,00;7;;2;years;;<p> 	Přijímač je nabízen pro různé druhy telefonů. Pro iPhony je umístěn v krytu, který je dodáván v různých barevných provedeních a pro telefony zn. Samsung formou fólie, která se lepí pod kryt Vašeho telefonu.</p> ;0;0;0;1;NULL_VALUE;NULL_VALUE;13;Přijímač (receiver) pro bezdrátové nabíjení;0;0;NULL_VALUE;0;NULL_VALUE;NULL_VALUE;0;0;0;NULL_VALUE;1;NULL_VALUE;Přijímač (receiver) pro bezdrátové nabíjení;Přijímač (receiver) pro bezdrátové nabíjení;33;
5357;Tlumič dorazu dvířek Blues;tlumic-dorazu-dvirek-blues;;;;1504517;;5;36,00;0,00;0,00;0,00;1;NULL_VALUE;0,00;7;;2;years;;<p> 	Tlumič Blues umožňuje tiché zavírání dvířek a výklopných dvířek. Tlumič lze zavrtat přímo do korpusové hrany o ø10mm nebo lze použít s adaptérem, který se našroubuje na korpus. Adaptér není součástí tlumiče a objednáv�&� se zvlášť. Tlumič byl testován v Německu a prošel 80.000 cykly.</p> ;0;0;0;1;NULL_VALUE;NULL_VALUE;7;Tlumič dorazu dvířek Blues;0;0;NULL_VALUE;0;NULL_VALUE;NULL_VALUE;0;0;0;NULL_VALUE;1;NULL_VALUE;Tlumič dorazu dvířek Blues;Tlumič dorazu dvířek Blues;8,33;
5358;Adaptér pro tlumič dorazu dvířek Blues;adapter-pro-tlumic-dorazu-dvirek-blues;;;;1504516;;5;5,00;0,00;0,00;0,00;1;NULL_VALUE;0,00;7;;2;years;;<p> 	Adaptér slouží jako doplněk k tlumiči dorazu dvířek Blues. Šroubuje se na korpus skříňky. Tlumič není součástí adaptéru a objednává &nbsp;se zvlášť.</p> ;0;0;0;1;NULL_VALUE;NULL_VALUE;7;Adaptér pro tlumič dorazu dvířek Blues;0;0;NULL_VALUE;0;NULL_VALUE;NULL_VALUE;0;0;0;NULL_VALUE;1;NULL_VALUE;Adaptér pro tlumič dorazu dvířek Blues;Adaptér pro tlumič dorazu dvířek Blues;8,33;
5359;Závěs pro sprchové kouty CPH sklo/stěna;zaves-pro-sprchove-kouty-cph-sklostena;;;;1523814;;5;1254,00;0,00;0,00;0,00;1;NULL_VALUE;0,00;8;;2;years;;<p> 	Závěs je vhodný pro uchycení skleněných dveří s montáží sklo - stěna. Závěs je mimo osu základny&nbsp;s možností nastavení síly zavírání (úhlové aretace) a samozavíráním při úhlu 25°.</p> ;0;0;0;1;NULL_VALUE;NULL_VALUE;3;Závěs pro sprchové kouty CPH sklo/stěna;0;0;NULL_VALUE;0;NULL_VALUE;NULL_VALUE;0;0;0;NULL_VALUE;1;NULL_VALUE;Závěs pro sprchové kouty CPH sklo/stěna;Závěs pro sprchové kouty CPH sklo/stěna;32;
5360;Kuličkový mikrovýsuv 8827;kulickovy-mikrovysuv-8827;výsuv;;;557822dc0fa04;;5;0,00;0,00;0,00;0,00;1;NULL_VALUE;0,00;7;;2;years;;<p> 	Uvedená cena je za pár.</p> ;0;0;0;1;NULL_VALUE;NULL_VALUE;11;Kuličkový mikrovýsuv 8827;0;0;NULL_VALUE;0;NULL_VALUE;NULL_VALUE;0;0;0;NULL_VALUE;1;NULL_VALUE;Kuličkový mikrovýsuv 8827;Kuličkový mikrovýsuv 8827;7;
5361;Narážecí matice zoubková M10x11;narazeci-matice-zoubkova-m10x11;;;;1211024;;5;3,00;0,00;0,00;0,00;1;NULL_VALUE;0,00;7;;2;years;;;0;0;0;1;NULL_VALUE;NULL_VALUE;6;Narážecí matice zoubková M10x11;0;0;NULL_VALUE;0;NULL_VALUE;NULL_VALUE;0;0;0;NULL_VALUE;1;NULL_VALUE;Narážecí matice zoubková M10x11;Narážecí matice zoubková M10x11;5;
5362;Válcový závěs 180°;valcovy-zaves-180;;;;1507223;;5;28,00;0,00;0,00;0,00;1;NULL_VALUE;0,00;7;;2;years;;<p> 	Skrytý závěs je určen pro spojení rozkládacích desek stolu.</p> ;0;0;0;1;NULL_VALUE;NULL_VALUE;10;Válcový závěs 180°;0;0;NULL_VALUE;0;NULL_VALUE;NULL_VALUE;0;0;0;NULL_VALUE;1;NULL_VALUE;Válcový závěs 180°;Válcový závěs 180°;8;
5363;Spojovací tyč pro sprchové kouty 45° sklo/stěna;spojovaci-tyc-pro-sprchove-kouty-45-sklostena;;;;1524025;;5;1254,00;0,00;0,00;0,00;1;NULL_VALUE;0,00;7;;2;years;;<p> 	Spojovací tyč slouží ka zpevnění skleněného boku sprchového koutu se stěnou pod úhlem 45°.</p> ;0;0;0;1;NULL_VALUE;NULL_VALUE;3;Spojovací tyč pro sprchové kouty 45° sklo/stěna;0;0;NULL_VALUE;0;NULL_VALUE;NULL_VALUE;0;0;0;NULL_VALUE;1;NULL_VALUE;Spojovací tyč pro sprchové kouty 45° sklo/stěna;Spojovací tyč pro sprchové kouty 45° sklo/stěna;32;
5364;Stolový závěs 180°;stolovy-zaves-180;;;;1580200;;5;29,00;0,00;0,00;0,00;1;NULL_VALUE;0,00;7;;2;years;;;0;0;0;1;NULL_VALUE;NULL_VALUE;7;Stolový závěs 180°;0;0;NULL_VALUE;0;NULL_VALUE;NULL_VALUE;0;0;0;NULL_VALUE;1;NULL_VALUE;Stolový závěs 180°;Stolový závěs 180°;4,8;
5365;Stavitelný kluzák;stavitelny-kluzak;;;;1016410;;5;9,00;0,00;0,00;0,00;1;NULL_VALUE;0,00;7;;2;years;;<p> 	Stavitelný kluzák o ø50mm s výškovou regulací 27-36mm.</p> ;0;0;0;1;NULL_VALUE;NULL_VALUE;2;Stavitelný kluzák;0;0;NULL_VALUE;0;NULL_VALUE;NULL_VALUE;0;0;0;NULL_VALUE;1;NULL_VALUE;Stavitelný kluzák;Stavitelný kluzák;31;
5366;Vymezovací podložka pro TEX závěsy;vymezovaci-podlozka-pro-tex-zavesy;;;;55af5c4504804;;5;0,00;0,00;0,00;0,00;1;NULL_VALUE;0,00;7;;2;years;;<p> 	Vymezovací podložka pro TEX závěsy je určena pro správné zajištění skla v závěsu dle jeho tloušťky.</p> ;0;0;0;1;NULL_VALUE;NULL_VALUE;3;Vymezovací podložka pro TEX závěsy;0;0;NULL_VALUE;0;NULL_VALUE;NULL_VALUE;0;0;0;NULL_VALUE;1;NULL_VALUE;Vymezovací podložka pro TEX závěsy;Vymezovací podložka pro TEX závěsy;27;
5367;Nábytkový zámek typ 400 s knoflíkem pro visací zámek - 19x20 mm;nabytkovy-zamek-typ-400-s-knoflikem-pro-visaci-zamek-1920-mm;;;;1404572;;5;58,00;0,00;0,00;0,00;1;0,00;0,00;10;;2;years;;<p> 	Zámek do plechových skříní uzamykaný pomocí visacího zámku. Otvor pro visací zámek o ø7,5mm. Visací zámek není součástí zámku.</p> ;0;1;0;1;NULL_VALUE;NULL_VALUE;1;Nábytkový zámek typ 400 s knoflíkem pro visací zámek - 19x20 mm;0;0;NULL_VALUE;0;NULL_VALUE;NULL_VALUE;0;0;0;NULL_VALUE;1;NULL_VALUE;Nábytkový zámek typ 400 s knoflíkem pro visací zámek - 19x20 mm;Nábytkový zámek typ 400 s knoflíkem pro visací zámek - 19x20 mm;16;
5368;Nábytkový zámek na sklo typ X-910;nabytkovy-zamek-na-sklo-typ-x-910;;;;55cdca0d49df8;;5;0,00;0,00;0,00;0,00;1;NULL_VALUE;0,00;7;;2;years;;<p> 	Zámek slouží k uzamykání jednoho křídla skleněných dveří do půdy nebo dna korpusu. Nutno vrtat otvor do skla.</p> ;0;0;0;1;NULL_VALUE;NULL_VALUE;1;Nábytkový zámek na sklo typ X-910;0;0;NULL_VALUE;0;NULL_VALUE;NULL_VALUE;0;0;0;NULL_VALUE;1;NULL_VALUE;Nábytkový zámek na sklo typ X-910;Nábytkový zámek na sklo typ X-910;17;
5369;Samostatný centrální zásuvkový zámek 1018 s jedním otvorem bez příslušenství;samostatny-centralni-zasuvkovy-zamek-1018-s-jednim-otvorem-bez-prislusenstvi;;;;5640986b361c7;;5;0,00;0,00;0,00;0,00;1;NULL_VALUE;0,00;7;;2;years;;;0;0;0;1;NULL_VALUE;NULL_VALUE;1;Samostatný centrální zásuvkový zámek 1018 s jedním otvorem bez příslušenství;0;0;NULL_VALUE;0;NULL_VALUE;NULL_VALUE;0;0;0;NULL_VALUE;1;NULL_VALUE;Samostatný centrální zásuvkový zámek 1018 s jedním otvorem bez příslušenství;Samostatný centrální zásuvkový zámek 1018 s jedním otvorem bez příslušenství;15;
5370;Závěs do masivu Flap;zaves-do-masivu-flap;;;;55eea296095bc;;5;0,00;0,00;0,00;0,00;1;NULL_VALUE;0,00;7;;2;years;;<p> 	Závěs je vyroben z nerez oceli 316 nebo z mosazi.</p> ;0;0;0;1;NULL_VALUE;NULL_VALUE;7;Závěs do masivu Flap;0;0;NULL_VALUE;0;NULL_VALUE;NULL_VALUE;0;0;0;NULL_VALUE;1;NULL_VALUE;Závěs do masivu Flap;Závěs do masivu Flap;8;
5371;Neopracovaný klíč k zámku X-750 starý profil;neopracovany-klic-k-zamku-x-750-stary-profil;;;;1404095;;5;25,00;0,00;0,00;0,00;1;NULL_VALUE;0,00;7;;2;years;;<p> 	Klíč slouží k vyrobení kopie klíče dle originálu.</p> ;0;0;0;1;NULL_VALUE;NULL_VALUE;1;Neopracovaný klíč k zámku X-750 starý profil;0;0;NULL_VALUE;0;NULL_VALUE;NULL_VALUE;0;0;0;NULL_VALUE;1;NULL_VALUE;Neopracovaný klíč k zámku X-750 starý profil;Neopracovaný klíč k zámku X-750 starý profil;19;
5372;Stavitelný kluzák Como ;stavitelny-kluzak-como;;;;56321fce9ba36;;5;0,00;0,00;0,00;0,00;1;NULL_VALUE;0,00;7;;2;years;;<p> 	<span stylefont-family: proxima-nova, sans-serif; font-size: 13px; line-height: 18.2px;>Ocelový stavitelný kluzák je dodáván včetně plastové spodní krytky o ø33mm.</span></p> ;0;0;0;1;NULL_VALUE;NULL_VALUE;2;Stavitelný kluzák Como ;0;0;NULL_VALUE;0;NULL_VALUE;NULL_VALUE;0;0;0;NULL_VALUE;1;NULL_VALUE;Stavitelný kluzák Como ;Stavitelný kluzák Como ;31;
5373;Klíč s trojhranným otvorem;klic-s-trojhrannym-otvorem;;;;1404140;;5;17,00;0,00;0,00;0,00;1;NULL_VALUE;0,00;7;;2;years;;<p> 	Náhradní klíč do univerzálního zámku 1920 s trojhranem (kód 1404483).</p> ;0;0;0;1;NULL_VALUE;NULL_VALUE;1;Klíč s trojhranným otvorem;0;0;NULL_VALUE;0;NULL_VALUE;NULL_VALUE;0;0;0;NULL_VALUE;1;NULL_VALUE;Klíč s trojhranným otvorem;Klíč s trojhranným otvorem;19;
5374;Centrální zásuvkový zámek 4103/600/3-do hrany;centralni-zasuvkovy-zamek-41036003-do-hrany;;;;1404044;;5;121,00;0,00;0,00;0,00;1;NULL_VALUE;0,00;8;;2;years;;<p> 	Minimální odběr 24ks.</p> <p> 	Zámek určený k centrálnímu zamykání zásuvek na sebou pomocí jednoho zámku a táhla.</p> <p> 	Využití:</p> <p> 	Zámek určený k centrálnímu zamykání 3ks zásuvek nad sebou s montáží zámku& do hrany, kdy zásuvky musí být vložené v korpusu. Pro více zásuvek je nutno dokoupit blokovací kolíky navíc. V případě nevhodné výšky blokovacího kolíku 8mm, možnost dokoupení kolíků o výšce 13mm a 19mm.</p> ;0;0;0;1;NULL_VALUE;NULL_VALUE;1;Centrální zásuvkový zámek 4103/600/3-do hrany;0;0;NULL_VALUE;0;NULL_VALUE;NULL_VALUE;0;0;0;NULL_VALUE;1;NULL_VALUE;Centrální zásuvkový zámek 4103/600/3-do hrany;Centrální zásuvkový zámek 4103/600/3-do hrany;15;
5375;Klíč generální Snake pro mincovní zámek;klic-generalni-snake-pro-mincovni-zamek;;;;1404137;;5;55,00;0,00;0,00;0,00;1;NULL_VALUE;0,00;7;;2;years;;;0;0;0;1;NULL_VALUE;NULL_VALUE;1;Klíč generální Snake pro mincovní zámek;0;0;NULL_VALUE;0;NULL_VALUE;NULL_VALUE;0;0;0;NULL_VALUE;1;NULL_VALUE;Klíč generální Snake pro mincovní zámek;Klíč generální Snake pro mincovní zámek;19;
5376;Klíč montážní Snake pro mincovní zámek;klic-montazni-snake-pro-mincovni-zamek;;;;1404138;;5;55,00;0,00;0,00;0,00;1;NULL_VALUE;0,00;7;;2;years;;;0;0;0;1;NULL_VALUE;NULL_VALUE;1;Klíč montážní Snake pro mincovní zámek;0;0;NULL_VALUE;0;NULL_VALUE;NULL_VALUE;0;0;0;NULL_VALUE;1;NULL_VALUE;Klíč montážní Snake pro mincovní zámek;Klíč montážní Snake pro mincovní zámek;19;
5377;Držák stolové nohy - UV - nerez;drzak-stolove-nohy-uv-nerez;;;;566eb652a771c;;5;0,00;0,00;0,00;0,00;1;NULL_VALUE;0,00;7;;2;years;;<p> 	Nerez držák je určen pro spojení stolové nohy se skleněnou deskou stolu s použitím UV lepidla.</p> ;0;0;0;1;NULL_VALUE;NULL_VALUE;3;Držák stolové nohy - UV - nerez;0;0;NULL_VALUE;0;NULL_VALUE;NULL_VALUE;0;0;0;NULL_VALUE;1;NULL_VALUE;Držák stolové nohy - UV - nerez;Držák stolové nohy - UV - nerez;4,26;
5378;Stolové nohy pro skleněné desky stolu - UV;stolove-nohy-pro-sklenene-desky-stolu-uv;;;;5698c05e23106;;5;0,00;0,00;0,00;0,00;1;NULL_VALUE;0,00;7;;2;years;;<p> 	<span stylefont-family: proxima-nova, sans-serif; font-size: 13px; line-height: 18.2px;>Stolové nohy slouží pro spojení se skleněnou deskou stolu za použití UV lepidla. Cena uvedena za sadu (4ks).</span></p> ;0;0;0;1;NULL_VALUE;NULL_VALUE;3;Stolové nohy pro skleněné desky stolu - UV;0;0;NULL_VALUE;0;NULL_VALUE;NULL_VALUE;0;0;0;NULL_VALUE;1;NULL_VALUE;Stolové nohy pro skleněné desky stolu - UV;Stolové nohy pro skleněné desky stolu - UV;4,26;
5379;Zdířka k zámku 1003 a rozvorovému zámku 7080/19;zdirka-k-zamku-1003-a-rozvorovemu-zamku-708019;;;;1405306;;5;3,00;0,00;0,00;0,00;1;NULL_VALUE;0,00;7;;2;years;;<p> 	Zdířka slouží pro čep bajonetového zámku 1003 nebo pro upevnění tyčí rozvorového zámku do korpusu.&nbsp;</p> ;0;0;0;1;NULL_VALUE;NULL_VALUE;1;Zdířka k zámku 1003 a rozvorovému zámku 7080/19;0;0;NULL_VALUE;0;NULL_VALUE;NULL_VALUE;0;0;0;NULL_VALUE;1;NULL_VALUE;Zdířka k zámku 1003 a rozvorovému zámku 7080/19;Zdířka k zámku 1003 a rozvorovému zámku 7080/19;19;
5380;Závěs 270°;zaves-270;;;;1504052;;5;113,00;0,00;0,00;0,00;1;NULL_VALUE;0,00;10;;2;years;;;0;0;0;1;NULL_VALUE;NULL_VALUE;7;Závěs 270°;0;0;NULL_VALUE;0;NULL_VALUE;NULL_VALUE;0;0;0;NULL_VALUE;1;NULL_VALUE;Závěs 270°;Závěs 270°;8;
5381;Neopracovaný klíč k zámku A-601S;neopracovany-klic-k-zamku-a-601s;;;;56b49c1dda51a;;5;0,00;0,00;0,00;0,00;1;NULL_VALUE;0,00;7;;2;years;;;0;0;0;1;NULL_VALUE;NULL_VALUE;1;Neopracovaný klíč k zámku A-601S;0;0;NULL_VALUE;0;NULL_VALUE;NULL_VALUE;0;0;0;NULL_VALUE;1;NULL_VALUE;Neopracovaný klíč k zámku A-601S;Neopracovaný klíč k zámku A-601S;19;
5382;Skrytý držák polic;skryty-drzak-polic;;;;56c19926d2238;;5;0,00;0,00;0,00;0,00;1;NULL_VALUE;0,00;7;;2;years;;<p> 	Cena uvedena za kus.</p> ;0;0;0;1;NULL_VALUE;NULL_VALUE;13;Skrytý držák polic;0;0;NULL_VALUE;0;NULL_VALUE;NULL_VALUE;0;0;0;NULL_VALUE;1;NULL_VALUE;Skrytý držák polic;Skrytý držák polic;33,39;
5383;Jazýček č.11 k zámkům série 1900;jazycek-c11-k-zamkum-serie-1900;;;;1404251;;5;5,00;0,00;0,00;0,00;1;NULL_VALUE;0,00;7;;2;years;;<p> 	Délka od osy 28mm.</p> ;0;0;0;1;NULL_VALUE;NULL_VALUE;1;Jazýček č.11 k zámkům série 1900;0;0;NULL_VALUE;0;NULL_VALUE;NULL_VALUE;0;0;0;NULL_VALUE;1;NULL_VALUE;Jazýček č.11 k zámkům série 1900;Jazýček č.11 k zámkům série 1900;19;
5384;Jazýček A10 k zámkům série 1900 + 5250;jazycek-a10-k-zamkum-serie-1900-5250;;;;1404710;;5;10,00;0,00;0,00;0,00;1;NULL_VALUE;0,00;7;;2;years;;<p> 	Délka od osy 50mm.</p> ;0;0;0;1;NULL_VALUE;NULL_VALUE;1;Jazýček A10 k zámkům série 1900 + 5250;0;0;NULL_VALUE;0;NULL_VALUE;NULL_VALUE;0;0;0;NULL_VALUE;1;NULL_VALUE;Jazýček A10 k zámkům série 1900 + 5250;Jazýček A10 k zámkům série 1900 + 5250;19;
5385;Jazýček č.9 + A01 k zámkům série 1900 + 5250;jazycek-c9-a01-k-zamkum-serie-1900-5250;;;;56d6bb2585043;;5;0,00;0,00;0,00;0,00;1;NULL_VALUE;0,00;7;;2;years;;<p> 	Délka od osy 25mm.</p> ;0;0;0;1;NULL_VALUE;NULL_VALUE;1;Jazýček č.9 + A01 k zámkům série 1900 + 5250;0;0;NULL_VALUE;0;NULL_VALUE;NULL_VALUE;0;0;0;NULL_VALUE;1;NULL_VALUE;Jazýček č.9 + A01 k zámkům série 1900 + 5250;Jazýček č.9 + A01 k zámkům série 1900 + 5250;19;
5386;Jazýček č.15 k zámkům série 1900;jazycek-c15-k-zamkum-serie-1900;;;;140415;;5;5,00;0,00;0,00;0,00;1;NULL_VALUE;0,00;7;;2;years;;<p> 	Délka od osy 28mm.</p> ;0;1;0;1;NULL_VALUE;NULL_VALUE;1;Jazýček č.15 k zámkům série 1900;0;0;NULL_VALUE;0;NULL_VALUE;NULL_VALUE;0;0;0;NULL_VALUE;1;NULL_VALUE;Jazýček č.15 k zámkům série 1900;Jazýček č.15 k zámkům série 1900;19;
5387;Univerzální nábytkový zámek 1920 s klipem;univerzalni-nabytkovy-zamek-1920-s-klipem;;;;1404488;;5;56,00;0,00;0,00;0,00;1;NULL_VALUE;0,00;7;;2;years;;<p> 	Zámek slouží k zamykání plechových boxů a skříní. Zámek je specifický tím, že <strong>klíč lze vyjmout pouze v zavřené poloze</strong>.</p> ;0;0;0;1;NULL_VALUE;NULL_VALUE;1;Univerzální nábytkový zámek 1920 s klipem;0;0;NULL_VALUE;0;NULL_VALUE;NULL_VALUE;0;0;0;NULL_VALUE;1;NULL_VALUE;Univerzální nábytkový zámek 1920 s klipem;Univerzální nábytkový zámek 1920 s klipem;16;
5388;Rozeta pro nábytkové zámky;rozeta-pro-nabytkove-zamky;;;;1404300;;5;5,00;0,00;0,00;0,00;1;NULL_VALUE;0,00;7;;2;years;;;0;0;0;1;NULL_VALUE;NULL_VALUE;1;Rozeta pro nábytkové zámky;0;0;NULL_VALUE;0;NULL_VALUE;NULL_VALUE;0;0;0;NULL_VALUE;1;NULL_VALUE;Rozeta pro nábytkové zámky;Rozeta pro nábytkové zámky;19;
5389;Podložka pro univerzální zámky;podlozka-pro-univerzalni-zamky;;;;1409340;;5;2,00;0,00;0,00;0,00;1;NULL_VALUE;0,00;7;;2;years;;;0;0;0;1;NULL_VALUE;NULL_VALUE;1;Podložka pro univerzální zámky;0;0;NULL_VALUE;0;NULL_VALUE;NULL_VALUE;0;0;0;NULL_VALUE;1;NULL_VALUE;Podložka pro univerzální zámky;Podložka pro univerzální zámky;19;
5390;Podložka kovová pro univerzální zámky;podlozka-kovova-pro-univerzalni-zamky;;;;1404307;;5;3,00;0,00;0,00;2,00;0;NULL_VALUE;0,00;7;;2;years;;;0;0;0;1;NULL_VALUE;NULL_VALUE;1;Podložka kovová pro univerzální zámky;0;0;NULL_VALUE;0;NULL_VALUE;NULL_VALUE;0;0;0;NULL_VALUE;1;NULL_VALUE;Podložka kovová pro univerzální zámky;Podložka kovová pro univerzální zámky;19;
5391;Tyčový závěs 2100 mm;tycovy-zaves-2100-mm;;;;15230019;;5;2695,00;0,00;0,00;0,00;1;NULL_VALUE;0,00;11;;2;years;;<p> 	Závěs pracuje v systému lift-up (vyzvednutí při otevření křídla a následné dosednutí do nulové polohy).</p> <p> 	<strong stylefont-family: proxima-nova, sans-serif; font-size: 13px; line-height: 18.2px;>Pozn.: Při rozměru nad &2m se účtuje dopravné 305,-Kč bez DPH (převodem) nebo 350,-Kč bez DPH (dobírkou).</strong></p> ;0;0;0;1;NULL_VALUE;NULL_VALUE;3;Tyčový závěs 2100 mm;0;0;NULL_VALUE;0;NULL_VALUE;NULL_VALUE;0;0;0;NULL_VALUE;1;NULL_VALUE;Tyčový závěs 2100 mm;Tyčový závěs 2100 mm;32;
5393;Kroužek pro slunečník;krouzek-pro-slunecnik;;;;0403500;;5;133,00;0,00;0,00;0,00;1;NULL_VALUE;0,00;8;;2;years;;;0;0;0;1;NULL_VALUE;NULL_VALUE;9;Kroužek pro slunečník;0;0;NULL_VALUE;0;NULL_VALUE;NULL_VALUE;0;0;0;NULL_VALUE;1;NULL_VALUE;Kroužek pro slunečník;Kroužek pro slunečník;10;
5394;Systém CLICK - spojovací část - samec;system-click-spojovaci-cast-samec;;;;1105818;;5;6,00;0,00;0,00;0,00;1;NULL_VALUE;0,00;7;;2;years;;<p> 	Systém CLICK je určen pro montáž stěnových či stropních panelů. Montáž pomocí vrutu o ø5mm nebo pomocí lepidla.</p> ;0;0;0;1;NULL_VALUE;NULL_VALUE;6;Systém CLICK - spojovací část - samec;0;0;NULL_VALUE;0;NULL_VALUE;NULL_VALUE;0;0;0;NULL_VALUE;1;NULL_VALUE;Systém CLICK - spojovací část - samec;Systém CLICK - spojovací část - samec;6;
5395;Systém CLICK - spojovací část - samice;system-click-spojovaci-cast-samice;;;;1105819;;5;9,00;0,00;0,00;0,00;1;NULL_VALUE;0,00;7;;2;years;;<p> 	Systém CLICK je určen pro montáž stěnových či stropních panelů. Montáž pomocí vrutu o ø5mm nebo pomocí lepidla.</p> ;0;0;0;1;NULL_VALUE;NULL_VALUE;6;Systém CLICK - spojovací část - samice;0;0;NULL_VALUE;0;NULL_VALUE;NULL_VALUE;0;0;0;NULL_VALUE;1;NULL_VALUE;Systém CLICK - spojovací část - samice;Systém CLICK - spojovací část - samice;6;
5396;Systém CLICK - označovací knoflík;system-click-oznacovaci-knoflik;;;;1105821;;5;16,00;0,00;0,00;0,00;1;NULL_VALUE;0,00;7;;2;years;;<p> 	Označovací knoflík slouží k přesnému označení umístění druhé části páru (samce).</p> ;0;0;0;1;NULL_VALUE;NULL_VALUE;6;Systém CLICK - označovací knoflík;0;0;NULL_VALUE;0;NULL_VALUE;NULL_VALUE;0;0;0;NULL_VALUE;1;NULL_VALUE;Systém CLICK - označovací knoflík;Systém CLICK - označovací knoflík;6;
5398;KD Systém - INVISIO typ 4034 klip - celozamykání;kd-system-invisio-typ-4034-klip-celozamykani;;;;1116080;;5;9,00;0,00;0,00;0,00;1;NULL_VALUE;0,00;8;;2;years;;;0;0;0;1;NULL_VALUE;NULL_VALUE;6;KD Systém - INVISIO typ 4034 klip - celozamykání;0;0;NULL_VALUE;0;NULL_VALUE;NULL_VALUE;0;0;0;NULL_VALUE;1;NULL_VALUE;KD Systém - INVISIO typ 4034 klip - celozamykání;KD Systém - INVISIO typ 4034 klip - celozamykání;6;
5399;KD Systém - INVISIO typ 4035 klip - polozamykání;kd-system-invisio-typ-4035-klip-polozamykani;;;;1116085;;5;9,00;0,00;0,00;0,00;1;NULL_VALUE;0,00;8;;2;years;;;0;0;0;1;NULL_VALUE;NULL_VALUE;6;KD Systém - INVISIO typ 4035 klip - polozamykání;0;0;NULL_VALUE;0;NULL_VALUE;NULL_VALUE;0;0;0;NULL_VALUE;1;NULL_VALUE;KD Systém - INVISIO typ 4035 klip - polozamykání;KD Systém - INVISIO typ 4035 klip - polozamykání;6;
5400;KD Systém - INVISIO typ 1165 vrut 4x16mm;kd-system-invisio-typ-1165-vrut-416-mm;;;;1116030;;5;8,00;0,00;0,00;0,00;1;NULL_VALUE;0,00;8;;2;years;;;0;0;0;1;NULL_VALUE;NULL_VALUE;6;KD Systém - INVISIO typ 1165 vrut 4x16mm;0;0;NULL_VALUE;1;NULL_VALUE;NULL_VALUE;0;0;0;NULL_VALUE;1;NULL_VALUE;KD Systém - INVISIO typ 1165 vrut 4x16mm;KD Systém - INVISIO typ 1165 vrut 4x16mm;6;
5401;KD Systém - INVISIO typ 2075 klip - bez uzamykání - samec;kd-system-invisio-typ-2075-klip-bez-uzamykani-samec;;;;1116050;;5;8,00;0,00;0,00;0,00;1;NULL_VALUE;0,00;7;;2;years;;;0;0;0;1;NULL_VALUE;NULL_VALUE;6;KD Systém - INVISIO typ 2075 klip - bez uzamykání - samec;0;0;NULL_VALUE;0;NULL_VALUE;NULL_VALUE;0;0;0;NULL_VALUE;1;NULL_VALUE;KD Systém - INVISIO typ 2075 klip - bez uzamykání - samec;KD Systém - INVISIO typ 2075 klip - bez uzamykání - samec;6;
5402;KD Systém - INVISIO typ 2076 klip - bez uzamykání - samice;kd-system-invisio-typ-2076-klip-bez-uzamykani-samice;;;;1116051;;5;8,00;0,00;0,00;0,00;1;NULL_VALUE;0,00;7;;2;years;;;0;0;0;1;NULL_VALUE;NULL_VALUE;6;KD Systém - INVISIO typ 2076 klip - bez uzamykání - samice;0;0;NULL_VALUE;0;NULL_VALUE;NULL_VALUE;0;0;0;NULL_VALUE;1;NULL_VALUE;KD Systém - INVISIO typ 2076 klip - bez uzamykání - samice;KD Systém - INVISIO typ 2076 klip - bez uzamykání - samice;6;
5403;KD Systém - INVISIO typ 5053A dřík 35mm;kd-system-invisio-typ-5053a-drik-35mm;;;;1116176;;5;7,00;0,00;0,00;0,00;1;NULL_VALUE;0,00;8;;2;years;;;0;0;0;1;NULL_VALUE;NULL_VALUE;6;KD Systém - INVISIO typ 5053A dřík 35mm;0;0;NULL_VALUE;0;NULL_VALUE;NULL_VALUE;0;0;0;NULL_VALUE;1;NULL_VALUE;KD Systém - INVISIO typ 5053A dřík 35mm;KD Systém - INVISIO typ 5053A dřík 35mm;6;
