id;h1;link;meta_keywords;meta_description;original_code;own_code;ean_code;vat_id;base_price;common_retail_price;shopping_price;discount;discount_type;stocked_items;minimal_count;product_availability_id;availability_description;guarantee;guarantee_unit;short_description;main_description;homepage;sale;recommended;show;supplier_id;producer_id;configuration_parameter_group_id;name;is_vat_included;facebook;social_plugin;new_product;discount_since;discount_to;show_top_category_description;show_2nd_top_category_description;show_3rd_top_category_description;max_cpc;toll_free;price_per_descriptive_parameter_id;meta_title;feed_name;categories;relatedProducts
4712;Nábytkový zámek SISO 850;nabytkovy-zamek-siso-850;nábytkový, zámek, 850, siso;;;51dae4d90e473;;5;0,00;0,00;0,00;0,00;1;0,00;0,00;7;;2;years;;;1;0;0;1;NULL_VALUE;NULL_VALUE;1;Nábytkový zámek SISO 850;0;0;NULL_VALUE;0;NULL_VALUE;NULL_VALUE;0;0;0;NULL_VALUE;1;NULL_VALUE;Nábytkový zámek SISO 850;Nábytkový zámek SISO 850;14,16;
4724;Nastavitelný nábytkový zámek Serbia;nastavitelny-nabytkovy-zamek-serbia;;;;1401015;;5;157,00;0,00;0,00;0,00;1;NULL_VALUE;0,00;7;;2;years;;<p> 	Nábytkový zámek s možností nastavení osové vzdálenosti.</p> ;0;0;0;1;NULL_VALUE;NULL_VALUE;1;Nastavitelný nábytkový zámek Serbia;0;0;NULL_VALUE;0;NULL_VALUE;NULL_VALUE;0;0;0;NULL_VALUE;1;NULL_VALUE;Nastavitelný nábytkový zámek Serbia;Nastavitelný nábytkový zámek Serbia;14;
4725;Nastavitelný nábytkový zámek X-965;nastavitelny-nabytkovy-zamek-x-965;;;;5236c9d082636;;5;1,00;0,00;0,00;0,00;1;NULL_VALUE;0,00;7;;2;years;;<p> 	Nábytkový zámek s možností nastavení osové vzdálenosti a následnou fixací 15, 20, 25, 30, 35 a 40 mm.</p> ;0;0;0;1;NULL_VALUE;NULL_VALUE;1;Nastavitelný nábytkový zámek X-965;0;0;NULL_VALUE;0;NULL_VALUE;NULL_VALUE;0;0;0;NULL_VALUE;1;NULL_VALUE;Nastavitelný nábytkový zámek X-965;Nastavitelný nábytkový zámek X-965;14,16;
4726;Nábytkový zámek Millennium 850-N;nabytkovy-zamek-millennium-850-n;;;;523aac79bf82b;;5;0,00;0,00;0,00;0,00;1;NULL_VALUE;0,00;7;;2;years;;;0;0;0;1;NULL_VALUE;NULL_VALUE;1;Nábytkový zámek Millennium 850-N;0;0;NULL_VALUE;0;NULL_VALUE;NULL_VALUE;0;0;0;NULL_VALUE;1;NULL_VALUE;Nábytkový zámek Millennium 850-N;Nábytkový zámek Millennium 850-N;14,16;
4727;Nábytkový zámek 852 tenké tělo;nabytkovy-zamek-852-tenke-telo;;;;5707734752db6;;5;0,00;0,00;0,00;0,00;1;NULL_VALUE;0,00;7;;2;years;;;0;0;0;1;NULL_VALUE;NULL_VALUE;1;Nábytkový zámek 852 tenké tělo;0;0;NULL_VALUE;0;NULL_VALUE;NULL_VALUE;0;0;0;NULL_VALUE;1;NULL_VALUE;Nábytkový zámek 852 tenké tělo;Nábytkový zámek 852 tenké tělo;14,16;
4728;Nábytkový zámek 850-dvojitý výsuv závory;nabytkovy-zamek-850-dvojity-vysuv-zavory;;;;1401090;;5;89,00;0,00;0,00;0,00;1;NULL_VALUE;0,00;7;;2;years;;<p> 	Zámek umožňující zamykání pomocí dlouhé závory.</p> ;0;0;0;1;NULL_VALUE;NULL_VALUE;1;Nábytkový zámek 850-dvojitý výsuv závory;0;0;NULL_VALUE;0;NULL_VALUE;NULL_VALUE;0;0;0;NULL_VALUE;1;NULL_VALUE;Nábytkový zámek 850-dvojitý výsuv závory;Nábytkový zámek 850-dvojitý výsuv závory;14,16;
4729;Nábytkový zámek Millennium 853-N;nabytkovy-zamek-millennium-853-n;;;;1401269;;5;75,00;0,00;0,00;0,00;0;NULL_VALUE;0,00;7;;2;years;;;0;0;0;1;NULL_VALUE;NULL_VALUE;1;Nábytkový zámek Millennium 853-N;0;0;NULL_VALUE;0;NULL_VALUE;NULL_VALUE;0;0;0;NULL_VALUE;1;NULL_VALUE;Nábytkový zámek Millennium 853-N;Nábytkový zámek Millennium 853-N;14,16;
4730;Nábytkový zámek 850-T-trubkový klíč;nabytkovy-zamek-850-t-trubkovy-klic;;;;1400101;;5;141,00;0,00;0,00;0,00;1;NULL_VALUE;0,00;7;;2;years;;<p> 	Nábytkový zámek s vysokým počtem neopakovatelnosti klíčů (2000ks). Další výhodou zámku je, že klíč nelze vyjmout ze zámku v odemčené poloze.</p> ;0;0;0;1;NULL_VALUE;NULL_VALUE;1;Nábytkový zámek 850-T-trubkový klíč;0;0;NULL_VALUE;0;NULL_VALUE;NULL_VALUE;0;0;0;NULL_VALUE;1;NULL_VALUE;Nábytkový zámek 850-T-trubkový klíč;Nábytkový zámek 850-T-trubkový klíč;14,16;
4731;Nábytkový zámek-dvojité zamykání;nabytkovy-zamek-dvojite-zamykani;;;;523ab3faad6f6;;5;0,00;0,00;0,00;0,00;1;NULL_VALUE;0,00;7;;2;years;;<p> 	Nábytkový zámek využívající možnosti zamykání do vertikální i horizontální strany. Vhodný hlavně pro dvojité dveře.</p> ;0;0;0;1;NULL_VALUE;NULL_VALUE;1;Nábytkový zámek-dvojité zamykání;0;0;NULL_VALUE;0;NULL_VALUE;NULL_VALUE;0;0;0;NULL_VALUE;1;NULL_VALUE;Nábytkový zámek-dvojité zamykání;Nábytkový zámek-dvojité zamykání;14,16;
4732;Nábytkový zámek střelkový 856;nabytkovy-zamek-strelkovy-856;;;;1401481;;5;90,00;0,00;0,00;0,00;1;NULL_VALUE;0,00;7;;2;years;;<p> 	Zámek vhodný hlavně pro hotelové minibary, příruční pokladny apod.</p> ;0;0;0;1;NULL_VALUE;NULL_VALUE;1;Nábytkový zámek střelkový 856;0;0;NULL_VALUE;0;NULL_VALUE;NULL_VALUE;0;0;0;NULL_VALUE;1;NULL_VALUE;Nábytkový zámek střelkový 856;Nábytkový zámek střelkový 856;14,16;
4733;Nábytkový zámek střelkový  856 s otočným knoflíkem;nabytkovy-zamek-strelkovy-856-s-otocnym-knoflikem;;;;1401486;;5;0,00;0,00;0,00;0,00;1;NULL_VALUE;0,00;10;;2;years;;<p> 	Zámek vhodný pro vybavení karavanů a nábytku na lodích.</p> ;0;0;0;1;NULL_VALUE;NULL_VALUE;1;Nábytkový zámek střelkový  856 s otočným knoflíkem;0;0;NULL_VALUE;0;NULL_VALUE;NULL_VALUE;0;0;0;NULL_VALUE;1;NULL_VALUE;Nábytkový zámek střelkový  856 s otočným knoflíkem;Nábytkový zámek střelkový  856 s otočným knoflíkem;14,16;
4734;Nábytkový zámek roletový 855;nabytkovy-zamek-roletovy-855;;;;523bf9e846370;;5;0,00;0,00;0,00;0,00;1;NULL_VALUE;0,00;7;;2;years;;<p> 	Nábytkový zámek využívaný k zamykání roletových (žaluziových) dveří v horizontální i vertikální poloze.</p> ;0;0;0;1;NULL_VALUE;NULL_VALUE;1;Nábytkový zámek roletový 855;0;0;NULL_VALUE;0;NULL_VALUE;NULL_VALUE;0;0;0;NULL_VALUE;1;NULL_VALUE;Nábytkový zámek roletový 855;Nábytkový zámek roletový 855;16;
4735;Nábytkový zámek roletový 855 tlačítkový;nabytkovy-zamek-roletovy-855-tlacitkovy;;;;1401462;;5;59,00;0,00;0,00;0,00;1;NULL_VALUE;0,00;7;;2;years;;<p> 	Nábytkový zámek využívaný k zamykání roletových (žaluziových) dveří v horizontální i vertikální poloze.</p> ;0;0;0;1;NULL_VALUE;NULL_VALUE;1;Nábytkový zámek roletový 855 tlačítkový;0;0;NULL_VALUE;0;NULL_VALUE;NULL_VALUE;0;0;0;NULL_VALUE;1;NULL_VALUE;Nábytkový zámek roletový 855 tlačítkový;Nábytkový zámek roletový 855 tlačítkový;16;
4736;Nábytkový zámek bajonetový 1003;nabytkovy-zamek-bajonetovy-1003;;;;523bff306f0ce;;5;0,00;0,00;0,00;0,00;0;NULL_VALUE;0,00;7;;2;years;;<p> 	Zámek pro uzamykání posuvných dveří umístěných proti sobě. V případě nutnosti použití prodlužovacích čepů A-1009, možnost přiobjednání viz. Doplňky, díly a příslušenství.</p> ;0;0;0;1;NULL_VALUE;NULL_VALUE;1;Nábytkový zámek bajonetový 1003;0;0;NULL_VALUE;0;NULL_VALUE;NULL_VALUE;0;0;0;NULL_VALUE;1;NULL_VALUE;Nábytkový zámek bajonetový 1003;Nábytkový zámek bajonetový 1003;16;
4737;Nábytkový zámek roletový 2159;nabytkovy-zamek-roletovy-2159;;;;1401470;;5;124,00;0,00;0,00;0,00;1;NULL_VALUE;0,00;7;;2;years;;<p> 	Nábytkový zámek využívaný k zamykání roletových (žaluziových) dveří v horizontální i vertikální poloze.</p> ;0;0;0;1;NULL_VALUE;NULL_VALUE;1;Nábytkový zámek roletový 2159;0;0;NULL_VALUE;0;NULL_VALUE;NULL_VALUE;0;0;0;NULL_VALUE;1;NULL_VALUE;Nábytkový zámek roletový 2159;Nábytkový zámek roletový 2159;16;
4738;Nábytkový zámek Verti;nabytkovy-zamek-verti;;;;1401405;;5;109,00;0,00;0,00;0,00;1;NULL_VALUE;0,00;7;;2;years;;<p> 	Nábytkový zámek využívaný k uzamykání posuvných dveří.</p> ;0;0;0;1;NULL_VALUE;NULL_VALUE;1;Nábytkový zámek Verti;0;0;NULL_VALUE;0;NULL_VALUE;NULL_VALUE;0;0;0;NULL_VALUE;1;NULL_VALUE;Nábytkový zámek Verti;Nábytkový zámek Verti;16;
4739;Nábytkový zámek 5250;nabytkovy-zamek-5250;;;;524929e46ddc6;;5;0,00;0,00;0,00;0,00;1;NULL_VALUE;0,00;7;;2;years;;;0;0;0;1;NULL_VALUE;NULL_VALUE;1;Nábytkový zámek 5250;0;0;NULL_VALUE;0;NULL_VALUE;NULL_VALUE;0;0;0;NULL_VALUE;1;NULL_VALUE;Nábytkový zámek 5250;Nábytkový zámek 5250;14,16;
4740;Nábytkový zámek 919;nabytkovy-zamek-919;;;;1403005;;5;77,00;0,00;0,00;0,00;1;NULL_VALUE;0,00;7;<p> 	str.23 dole</p> ;2;years;;;0;0;0;1;NULL_VALUE;NULL_VALUE;1;Nábytkový zámek 919;0;0;NULL_VALUE;0;NULL_VALUE;NULL_VALUE;0;0;0;NULL_VALUE;1;NULL_VALUE;Nábytkový zámek 919;Nábytkový zámek 919;14,16;
4741;Univerzální nábytkový zámek 1216;univerzalni-nabytkovy-zamek-1216;;;;533d1a252aa7a;;5;0,00;0,00;0,00;0,00;0;NULL_VALUE;0,00;7;;2;years;;<p> 	Univerzální zámek pro zamykání dřevěných, plechových a prosklených boxů a skříní.</p> ;0;0;0;1;NULL_VALUE;NULL_VALUE;1;Univerzální nábytkový zámek 1216;0;0;NULL_VALUE;0;NULL_VALUE;NULL_VALUE;0;0;0;NULL_VALUE;1;NULL_VALUE;Univerzální nábytkový zámek 1216;Univerzální nábytkový zámek 1216;16;
4742;Univerzální nábytkový zámek 1916;univerzalni-nabytkovy-zamek-1916;;;;52492e82b4692;;5;0,00;0,00;0,00;0,00;0;NULL_VALUE;0,00;7;;2;years;;<p> 	Univerzální zámek pro zamykání dřevěných, plechových a prosklených boxů a skříní. Skladem pouze zámek z kónickým čelem (obrázek vpravo), zámek s oblým čelem (obrázek vlevo) jen na objednání.</p> ;0;0;0;1;NULL_VALUE;NULL_VALUE;1;Univerzální nábytkový zámek 1916;0;0;NULL_VALUE;0;NULL_VALUE;NULL_VALUE;0;0;0;NULL_VALUE;1;NULL_VALUE;Univerzální nábytkový zámek 1916;Univerzální nábytkový zámek 1916;16;
4743;Univerzální nábytkový zámek 1920;univerzalni-nabytkovy-zamek-1920;;;;524a7b4d277a9;;5;0,00;0,00;0,00;0,00;0;NULL_VALUE;0,00;7;;2;years;;<p> 	Univerzální zámek pro zamykání dřevěných, plechových a prosklených boxů a skříní. Skladem pouze zámky s kónickým čelem (obrázek vpravo), zámky s oblým čelem (obrázek vlevo) jen na objednání.</p> ;0;0;0;1;NULL_VALUE;NULL_VALUE;1;Univerzální nábytkový zámek 1920;0;0;NULL_VALUE;0;NULL_VALUE;NULL_VALUE;0;0;0;NULL_VALUE;1;NULL_VALUE;Univerzální nábytkový zámek 1920;Univerzální nábytkový zámek 1920;16;
4746;Univerzální nábytkový zámek 1920 trojhranný klíč;univerzalni-nabytkovy-zamek-1920-trojhranny-klic;;;;1404483;;5;56,00;0,00;0,00;0,00;1;NULL_VALUE;0,00;7;;2;years;;<p> 	Univerzální zámek pro zamykání dřevěných, plechových a prosklených boxů a skříní. Klíč lze vytáhnout v otevřené i zavřené poloze.</p> ;0;0;0;1;NULL_VALUE;NULL_VALUE;1;Univerzální nábytkový zámek 1920 trojhranný klíč;0;0;NULL_VALUE;0;NULL_VALUE;NULL_VALUE;0;0;0;NULL_VALUE;1;NULL_VALUE;Univerzální nábytkový zámek 1920 trojhranný klíč;Univerzální nábytkový zámek 1920 trojhranný klíč;16;
4747;Nábytkový zámek typ 300 s knoflíkem pro visací zámek - 19x16 mm;nabytkovy-zamek-typ-300-s-knoflikem-pro-visaci-zamek-1916-mm;;;;14045850;;5;123,00;0,00;0,00;0,00;1;NULL_VALUE;0,00;7;;2;years;;<p> 	Univerzální zámek uzamykaný pomocí visacího zámku. Visací zámek není součástí balení.&nbsp;V případě montáže do dřevěného materiálu je možné doobjednat podložku proti pootočení viz.Doplňky, díly a příslušenství.</p&> ;0;0;0;1;NULL_VALUE;NULL_VALUE;1;Nábytkový zámek typ 300 s knoflíkem pro visací zámek - 19x16 mm;0;0;NULL_VALUE;0;NULL_VALUE;NULL_VALUE;0;0;0;NULL_VALUE;1;NULL_VALUE;Nábytkový zámek typ 300 s knoflíkem pro visací zámek - 19x16 mm;Nábytkový zámek typ 300 s knoflíkem pro visací zámek - 19x16 mm;16;
4748;Přídavný zámek typ 281 s knoflíkem;pridavny-zamek-typ-281-s-knoflikem;;;;1401230;;5;165,00;0,00;0,00;0,00;1;NULL_VALUE;0,00;7;;2;years;;<p> 	Přídavný zámek sloužící k uzamykání převlíkacích kabin a kabin pro osobní soukromí.</p> ;0;1;0;1;NULL_VALUE;NULL_VALUE;1;Přídavný zámek typ 281 s knoflíkem;0;0;NULL_VALUE;0;NULL_VALUE;NULL_VALUE;0;0;0;NULL_VALUE;1;NULL_VALUE;Přídavný zámek typ 281 s knoflíkem;Přídavný zámek typ 281 s knoflíkem;18;
4749;Nábytkový zámek x-44/X pro plechový nábytek;nabytkovy-zamek-x-44x-pro-plechovy-nabytek;;;;524a967870805;;5;0,00;0,00;0,00;0,00;1;NULL_VALUE;0,00;7;;2;years;;<p> 	Zámek využívaný k zamykání plechových skříní a zásuvek bez použití převlečné matice.</p> ;0;0;0;1;NULL_VALUE;NULL_VALUE;1;Nábytkový zámek x-44/X pro plechový nábytek;0;0;NULL_VALUE;0;NULL_VALUE;NULL_VALUE;0;0;0;NULL_VALUE;1;NULL_VALUE;Nábytkový zámek x-44/X pro plechový nábytek;Nábytkový zámek x-44/X pro plechový nábytek;14,16;
4750;Nábytkový zámek x-44/D pro plechový nábytek;nabytkovy-zamek-x-44d-pro-plechovy-nabytek;;;;1408090;;5;63,00;0,00;0,00;0,00;1;NULL_VALUE;0,00;7;;2;years;;<p> 	Centrální zámek pro uzamykání zásuvek vyrobených z plechu.</p> ;0;0;0;1;NULL_VALUE;NULL_VALUE;1;Nábytkový zámek x-44/D pro plechový nábytek;0;0;NULL_VALUE;0;NULL_VALUE;NULL_VALUE;0;0;0;NULL_VALUE;1;NULL_VALUE;Nábytkový zámek x-44/D pro plechový nábytek;Nábytkový zámek x-44/D pro plechový nábytek;14,16;
4751;Nábytkový zámek L-klika typ L-44/X pro plechový nábytek;nabytkovy-zamek-l-klika-typ-l-44x-pro-plechovy-nabytek;;;;5c501ec470742;;5;0,00;0,00;0,00;0,00;1;NULL_VALUE;0,00;7;;2;years;;<p> 	Zámek slouží k zamykání plechových skříní, boxů a autoskříní.</p> ;0;0;0;1;NULL_VALUE;NULL_VALUE;1;Nábytkový zámek L-klika typ L-44/X pro plechový nábytek;0;0;NULL_VALUE;0;NULL_VALUE;NULL_VALUE;0;0;0;NULL_VALUE;1;NULL_VALUE;Nábytkový zámek L-klika typ L-44/X pro plechový nábytek;Nábytkový zámek L-klika typ L-44/X pro plechový nábytek;16;
4752;Nábytkový zámek T-klika typ T-44/X pro plechový nábytek;nabytkovy-zamek-t-klika-typ-t-44x-pro-plechovy-nabytek;;;;1408055;;5;172,00;0,00;0,00;0,00;1;NULL_VALUE;0,00;7;;2;years;;<p> 	Zámek slouží k zamykání plechových skříní, boxů a autoskříní.</p> ;0;0;0;1;NULL_VALUE;NULL_VALUE;1;Nábytkový zámek T-klika typ T-44/X pro plechový nábytek;0;0;NULL_VALUE;0;NULL_VALUE;NULL_VALUE;0;0;0;NULL_VALUE;1;NULL_VALUE;Nábytkový zámek T-klika typ T-44/X pro plechový nábytek;Nábytkový zámek T-klika typ T-44/X pro plechový nábytek;16;
4753;Nábytkový zámek T-klika typ 177 pro plechový nábytek;nabytkovy-zamek-t-klika-typ-177-pro-plechovy-nabytek;;;;1408056;;5;204,00;0,00;0,00;0,00;1;NULL_VALUE;0,00;7;;2;years;;<p> 	Zámek slouží k zamykání plechových skříní, boxů a autoskříní.</p> ;0;0;0;1;NULL_VALUE;NULL_VALUE;1;Nábytkový zámek T-klika typ 177 pro plechový nábytek;0;0;NULL_VALUE;0;NULL_VALUE;NULL_VALUE;0;0;0;NULL_VALUE;1;NULL_VALUE;Nábytkový zámek T-klika typ 177 pro plechový nábytek;Nábytkový zámek T-klika typ 177 pro plechový nábytek;16;
4754;Centrální zásuvkový zámek 851N/600/3-boční;centralni-zasuvkovy-zamek-851n6003-bocni;;;;1401328;;5;139,00;0,00;0,00;0,00;1;NULL_VALUE;0,00;7;;2;years;;<p> 	Zámek určený k centrálnímu zamykání zásuvek nad sebou, pomocí jednoho zámku a táhla.</p> <p> 	Využití:</p> <p> 	Zámek určený k centrálnímu zamykání 3ks zásuvek nad sebou s boční montáží zámku. Pro více zásuvek je nu&tno dokoupit blokovací kolíky navíc. Při nevhodné výšce blokovacího kolíku 13mm, možnost dokoupení kolíků o výšce 8mm nebo 19mm.&nbsp;<span stylefont-family: proxima-nova, sans-serif; font-size: 13px; line-height: 18.2px; text-align: ju&stify;>V případě použití tzv. blokací zásuvek, doporučujeme objednat plastové blokovací segmenty pro každou zásuvku.</span></p> ;0;0;0;1;NULL_VALUE;NULL_VALUE;1;Centrální zásuvkový zámek 851N/600/3-boční;0;0;NULL_VALUE;0;NULL_VALUE;NULL_VALUE;0;0;0;NULL_VALUE;1;NULL_VALUE;Centrální zásuvkový zámek 851N/600/3-boční;Centrální zásuvkový zámek 851N/600/3-boční;15;
4755;Centrální zásuvkový zámek 1018/600/3-čelní;centralni-zasuvkovy-zamek-10186003-celni;;;;1403113;;5;110,00;0,00;0,00;0,00;1;NULL_VALUE;0,00;10;;2;years;;<p styletext-align: justify;> 	Zámek určený k centrálnímu zamykání zásuvek nad sebou, pomocí jednoho zámku a táhla.</p> <p styletext-align: justify;> 	Využití:</p> <p styletext-align: justify;> 	Zámek určený k centrál&nímu zamykání 3ks zásuvek nad sebou s čelní montáží zámku. Pro více zásuvek je nutno dokoupit blokovací kolíky navíc. V případě jiné výšky blokovacího kolíku než 13mm, možnost dokoupení kolíků 8mm a 19mm. Pro jinou výšku kon&tejneru lze dokoupit táhla o délce 500, 700, 800, 1200 a 1300mm. Možnost kombinace všech uvedených parametrů vč. zámku na stejný uzávěr. To znamená např. požadujeme uzamykání 4 zásuvek u kontejneru o výšce 700mm a zamykání na stejný& uzávěr, protože v místnosti budou 2 tyto kontejnery a chceme je odemykat jedním klíčem a navíc bude potřeba kolík o výšce 8mm. V tomto případě objednávka bude znít takto:</p> <p styletext-align: justify;> 	2ks samostatný zámek &1018 SU (stejný uzávěr) ø19x20mm, ni-lesk - kód 1403136&nbsp;</p> <p styletext-align: justify;> 	2ks táhlo 700mm - kód 1404190</p> <p styletext-align: justify;> 	4ks plechové vodítko táhla - kód 1404091</p> <p styletext-align&: justify;> 	8ks blokovací kollík 8mm - kód 1404310 &nbsp; &nbsp; &nbsp; &nbsp; &nbsp; &nbsp; &nbsp; &nbsp; &nbsp; &nbsp; &nbsp; &nbsp; &nbsp; &nbsp; &nbsp; &nbsp; &nbsp; &nbsp; &nbsp; &nbsp; &nbsp; &nbsp; &nbsp; &nbsp; &nbsp; &nbsp; &nbsp; &nbsp; &&nbsp; &nbsp; &nbsp; &nbsp; &nbsp; &nbsp; &nbsp; &nbsp; &nbsp; &nbsp; &nbsp; &nbsp; &nbsp; &nbsp; &nbsp; &nbsp; &nbsp; &nbsp; &nbsp; &nbsp; &nbsp; &nbsp; &nbsp; &nbsp; &nbsp; &nbsp; &nbsp; &nbsp; &nbsp; &nbsp; &nbsp; &nbsp; &nbsp; &nbsp; &nbsp; &nbsp; &n&bsp; &nbsp; &nbsp; &nbsp; &nbsp; &nbsp; &nbsp; &nbsp; &nbsp; &nbsp; &nbsp; &nbsp; &nbsp; &nbsp; &nbsp; &nbsp; &nbsp; &nbsp; &nbsp; &nbsp; &nbsp; &nbsp; &nbsp; &nbsp; &nbsp; &nbsp; &nbsp; &nbsp; &nbsp; &nbsp; &nbsp; &nbsp; &nbsp;</p> <p styletext-alig&n: justify;> 	V případě použití tzv. blokací zásuvek, doporučujeme objednat plastové blokovací segmenty pro každou zásuvku - kód 1402010</p> <p styletext-align: justify;> 	<strong>Všechny tyto nestandardní díly najdete v odděle&ní &nbsp;doplňky, díly a příslušenství.&nbsp;</strong></p> <p styletext-align: justify;> 	Jestliže vám vyhovuje standardní provedení centrálního zámku 1018/600/3, stačí zvolit objednací kód 1403113 a obdržíte standardní sa&du viz. popis výše (1ks zámek ø16,5x20mm s rozetou, táhlo 600mm, 2ks plechové vodítko táhla a 3ks blokovací kolík 13mm).</p> ;1;0;0;1;NULL_VALUE;NULL_VALUE;1;Centrální zásuvkový zámek 1018/600/3-čelní;0;0;NULL_VALUE;0;NULL_VALUE;NULL_VALUE;0;0;0;NULL_VALUE;1;NULL_VALUE;Centrální zásuvkový zámek 1018/600/3-čelní;Centrální zásuvkový zámek 1018/600/3-čelní;15;
4756;Samostatný centrální zásuvkový zámek 1018 bez příslušenství;samostatny-centralni-zasuvkovy-zamek-1018-bez-prislusenstvi;;;;525270e6d0a19;;5;0,00;0,00;0,00;0,00;1;NULL_VALUE;0,00;7;;2;years;;;0;0;0;1;NULL_VALUE;NULL_VALUE;1;Samostatný centrální zásuvkový zámek 1018 bez příslušenství;0;0;NULL_VALUE;0;NULL_VALUE;NULL_VALUE;0;0;0;NULL_VALUE;1;NULL_VALUE;Samostatný centrální zásuvkový zámek 1018 bez příslušenství;Samostatný centrální zásuvkový zámek 1018 bez příslušenství;15;
4757;Samostatné táhlo k centrálnímu zámku ;samostatne-tahlo-k-centralnimu-zamku;;;;525275e7152a1;;5;0,00;0,00;0,00;0,00;1;NULL_VALUE;0,00;8;;2;years;;;0;0;0;1;NULL_VALUE;NULL_VALUE;1;Samostatné táhlo k centrálnímu zámku ;0;0;NULL_VALUE;0;NULL_VALUE;NULL_VALUE;0;0;0;NULL_VALUE;1;NULL_VALUE;Samostatné táhlo k centrálnímu zámku ;Samostatné táhlo k centrálnímu zámku ;15;
4758;Blokovací kolík zásuvky k centrálnímu zámku;blokovaci-kolik-zasuvky-k-centralnimu-zamku;;;;5253ad9d9b639;;5;0,00;0,00;0,00;0,00;1;NULL_VALUE;0,00;7;;2;years;;;0;0;0;1;NULL_VALUE;NULL_VALUE;1;Blokovací kolík zásuvky k centrálnímu zámku;0;0;NULL_VALUE;0;NULL_VALUE;NULL_VALUE;0;0;0;NULL_VALUE;1;NULL_VALUE;Blokovací kolík zásuvky k centrálnímu zámku;Blokovací kolík zásuvky k centrálnímu zámku;15;
4759;Plechové vodítko táhla k centrálnímu zámku;plechove-voditko-tahla-k-centralnimu-zamku;;;;1404091;;5;5,00;0,00;0,00;0,00;1;NULL_VALUE;0,00;7;;2;years;;;0;0;0;1;NULL_VALUE;NULL_VALUE;1;Plechové vodítko táhla k centrálnímu zámku;0;0;NULL_VALUE;0;NULL_VALUE;NULL_VALUE;0;0;0;NULL_VALUE;1;NULL_VALUE;Plechové vodítko táhla k centrálnímu zámku;Plechové vodítko táhla k centrálnímu zámku;15;
4760;Blokace zásuvky 1 k centrálnímu zámku;blokace-zasuvky-1-k-centralnimu-zamku;;;;1402010;;5;4,00;0,00;0,00;0,00;1;NULL_VALUE;0,00;7;;2;years;;<p> 	Blokace zásuvky slouží k zablokování blokovacího kolíku o bočnici zásuvky.</p> ;0;0;0;1;NULL_VALUE;NULL_VALUE;1;Blokace zásuvky 1 k centrálnímu zámku;0;0;NULL_VALUE;0;NULL_VALUE;NULL_VALUE;0;0;0;NULL_VALUE;1;NULL_VALUE;Blokace zásuvky 1 k centrálnímu zámku;Blokace zásuvky 1 k centrálnímu zámku;15;
4762;Samostatná tyč k třícestnému zámku;samostatna-tyc-k-tricestnemu-zamku;;;;5253ba8dd9498;;5;0,00;0,00;0,00;0,00;0;NULL_VALUE;0,00;7;;2;years;;<p> 	Cena uvedena za kus. Do kompletu se zámkem je nutno objednat 2ks tyčí.</p> ;0;0;0;1;NULL_VALUE;NULL_VALUE;1;Samostatná tyč k třícestnému zámku;0;0;NULL_VALUE;0;NULL_VALUE;NULL_VALUE;0;0;0;NULL_VALUE;1;NULL_VALUE;Samostatná tyč k třícestnému zámku;Samostatná tyč k třícestnému zámku;16,19;
4763;Samostatný třícestný nábytkový zámek typ 922;samostatny-tricestny-nabytkovy-zamek-typ-922;;;;5253bb01ece3b;;5;0,00;0,00;0,00;0,00;0;NULL_VALUE;0,00;7;;2;years;;<p> 	Tyče nejsou součástí zámku, je nutné objednat zvlášť.</p> ;0;0;0;1;NULL_VALUE;NULL_VALUE;1;Samostatný třícestný nábytkový zámek typ 922;0;0;NULL_VALUE;0;NULL_VALUE;NULL_VALUE;0;0;0;NULL_VALUE;1;NULL_VALUE;Samostatný třícestný nábytkový zámek typ 922;Samostatný třícestný nábytkový zámek typ 922;16,19;
4764;Samostatné příslušenství k třícestnému zámku typ 922;samostatne-prislusenstvi-k-tricestnemu-zamku-typ-922;;;;1405740;;5;44,00;0,00;0,00;0,00;1;NULL_VALUE;0,00;7;;2;years;;<p> 	Samostatné příslušenství k třícestnému zámku slouží k uchycení zámku a táhel.</p> ;0;0;0;1;NULL_VALUE;NULL_VALUE;1;Samostatné příslušenství k třícestnému zámku typ 922;0;0;NULL_VALUE;0;NULL_VALUE;NULL_VALUE;0;0;0;NULL_VALUE;1;NULL_VALUE;Samostatné příslušenství k třícestnému zámku typ 922;Samostatné příslušenství k třícestnému zámku typ 922;19;
4766;Samostatná tyč k rozvorovému nábytkovému zámku ;samostatna-tyc-k-rozvorovemu-nabytkovemu-zamku;;;;52550185a7e3a;;5;0,00;0,00;0,00;0,00;0;NULL_VALUE;0,00;7;;2;years;;<p> 	Cena uvedena za kus. Do kompletu se zámkem je nutno objednat 2ks tyčí.</p> ;0;0;0;1;NULL_VALUE;NULL_VALUE;1;Samostatná tyč k rozvorovému nábytkovému zámku ;0;0;NULL_VALUE;0;NULL_VALUE;NULL_VALUE;0;0;0;NULL_VALUE;1;NULL_VALUE;Samostatná tyč k rozvorovému nábytkovému zámku ;Samostatná tyč k rozvorovému nábytkovému zámku ;16,19;
4767;Samostatný rozvorový nábytkový zámek 7080/19;samostatny-rozvorovy-nabytkovy-zamek-708019;;;;525502ebd9854;;5;0,00;0,00;0,00;0,00;1;NULL_VALUE;0,00;7;;2;years;;<p> 	Tyče nejsou součástí zámku, je nutné objednat zvlášť.</p> ;0;0;0;1;NULL_VALUE;NULL_VALUE;1;Samostatný rozvorový nábytkový zámek 7080/19;0;0;NULL_VALUE;0;NULL_VALUE;NULL_VALUE;0;0;0;NULL_VALUE;1;NULL_VALUE;Samostatný rozvorový nábytkový zámek 7080/19;Samostatný rozvorový nábytkový zámek 7080/19;16,19;
4768;Protiplech s výřezem;protiplech-s-vyrezem;;;;1401510;;5;5,00;0,00;0,00;0,00;0;NULL_VALUE;0,00;7;;2;years;;<p> 	Univerzální protiplech pro různé typy zámků.</p> ;0;0;0;1;NULL_VALUE;NULL_VALUE;1;Protiplech s výřezem;0;0;NULL_VALUE;0;NULL_VALUE;NULL_VALUE;0;0;0;NULL_VALUE;1;NULL_VALUE;Protiplech s výřezem;Protiplech s výřezem;19;
4769;Protiplech lomený DS-02;protiplech-lomeny-ds-02;;;;1401064;;5;4,00;0,00;0,00;0,00;0;NULL_VALUE;0,00;7;;2;years;;<p> 	Univerzální protiplech pro různé typy zámků.</p> ;0;0;0;1;NULL_VALUE;NULL_VALUE;1;Protiplech lomený DS-02;0;0;NULL_VALUE;0;NULL_VALUE;NULL_VALUE;0;0;0;NULL_VALUE;1;NULL_VALUE;Protiplech lomený DS-02;Protiplech lomený DS-02;19;
4770;Protiplech speciální;protiplech-specialni;;;;1401500;;5;15,00;0,00;0,00;0,00;1;NULL_VALUE;0,00;7;;2;years;;;0;0;0;1;NULL_VALUE;NULL_VALUE;1;Protiplech speciální;0;0;NULL_VALUE;0;NULL_VALUE;NULL_VALUE;0;0;0;NULL_VALUE;1;NULL_VALUE;Protiplech speciální;Protiplech speciální;19;
4771;Neopracovaný klíč oboustranný;neopracovany-klic-oboustranny;;;;525506af4b703;;5;0,00;0,00;0,00;0,00;1;NULL_VALUE;0,00;7;;2;years;;<p> 	Klíč slouží k vyrobení kopie klíče dle originálu.</p> ;0;0;0;1;NULL_VALUE;NULL_VALUE;1;Neopracovaný klíč oboustranný;0;0;NULL_VALUE;0;NULL_VALUE;NULL_VALUE;0;0;0;NULL_VALUE;1;NULL_VALUE;Neopracovaný klíč oboustranný;Neopracovaný klíč oboustranný;19;
4772;Nábytkový zámek Afric;nabytkovy-zamek-afric;;;;1406145;;5;25,00;0,00;0,00;0,00;1;NULL_VALUE;0,00;11;;2;years;;<p> 	Zámek s možností zamykání ve vertikální nebo horizontální poloze pomocí obyčejného klíče, který je součástí balení.</p> ;0;0;0;1;NULL_VALUE;NULL_VALUE;1;Nábytkový zámek Afric;0;0;NULL_VALUE;0;NULL_VALUE;NULL_VALUE;0;0;0;NULL_VALUE;1;NULL_VALUE;Nábytkový zámek Afric;Nábytkový zámek Afric;16;
